citationid,Name,Year,Title,Abstract,FullTextLink
Cury_58_2022,"Cury, Otávio (Federal University of Piauí, BRA);Avelino, Guilherme (Federal University of Piauí, BRA);Neto, Pedro Santos (Federal University of Piauí, BRA);Britto, Ricardo [rbr] [0000-0002-7220-9570] (Blekinge Tekniska Högskola [16500], Fakulteten för datavetenskaper [16801], Institutionen för programvaruteknik [16805]);Valente, Marco Túlio (Federal University of Minas Gerais, BRA)",2022,Identifying Source Code File Experts,"<p>Background: In software development, the identification of source code file experts is an important task. Identifying these experts helps to improve software maintenance and evolution activities, such as developing new features, code reviews, and bug fixes. Although some studies have proposed repository-mining techniques to automatically identify source code experts, there are still gaps in this area that can be explored. For example, investigating new variables related to source code knowledge and applying machine learning aiming to improve the performance of techniques to identify source code experts. Aim: The goal of this study is to investigate opportunities to improve the performance of existing techniques to recommend source code files experts. Method: We built an oracle by collecting data from the development history and surveying developers of 113 software projects. Then, we use this oracle to: (i) analyze the correlation between measures extracted from the development history and the developers' source code knowledge and (ii) investigate the use of machine learning classifiers by evaluating their performance in identifying source code files experts. Results: First Authorship and Recency of Modification are the variables with the highest positive and negative correlations with source code knowledge, respectively. Machine learning classifiers outperformed the linear techniques (F-Measure = 71% to 73%) in the public dataset, but this advantage is not clear in the private dataset, with F-Measure ranging from 55% to 68% for the linear techniques and 58% to 67% for ML techniques. Conclusion: Overall, the linear techniques and the machine learning classifiers achieved similar performance, particularly if we analyze F-Measure. However, machine learning classifiers usually get higher precision while linear techniques obtained the highest recall values. Therefore, the choice of the best technique depends on the user's tolerance to false positives and false negatives. © 2022 Association for Computing Machinery.</p>",
Vieira_332_2022,"Vieira, Renan (Federal University of Ceará Fortaleza, BRA);Mesquita, Diego (Getulio Vargas Foundation Rio de Janeiro, BRA);Mattos, César Lincoln (Federal University of Ceará Fortaleza, BRA);Britto, Ricardo [rbr] [0000-0002-7220-9570] (Blekinge Tekniska Högskola [16500], Fakulteten för datavetenskaper [16801], Institutionen för programvaruteknik [16805]);Rocha, Lincoln (Federal University of Ceará Fortaleza, BRA);Gomes, João (Federal University of Ceará Fortaleza, BRA)",2022,Bayesian Analysis of Bug-Fixing Time using Report Data,"<p>Background: Bug-fixing is the crux of software maintenance. It entails tending to heaps of bug reports using limited resources. Using historical data, we can ask questions that contribute to betterinformed allocation heuristics. The caveat here is that often there is not enough data to provide a sound response. This issue is especially prominent for young projects. Also, answers may vary from project to project. Consequently, it is impossible to generalize results without assuming a notion of relatedness between projects.</p><p>Aims: Evaluate the independent impact of three report features in the bug-fixing time (BFT), generalizing results from many projects: bug priority, code-churn size in bug fixing commits, and existence of links to other reports (e.g., depends on or blocks other bug reports).</p><p>Method: We analyze 55 projects from the Apache ecosystem using Bayesian statistics. Similar to standard random effects methodology, we assume each project's average BFT is a dispersed version of a global average BFT that we want to assess. We split the data based on feature values/range (e.g., with or without links). For each split, we compute a posterior distribution over its respective global BFT. Finally, we compare the posteriors to establish the feature's effect on the BFT. We run independent analyses for each feature.</p><p>Results: Our results show that the existence of links and higher code-churn values lead to BFTs that are at least twice as long. On the other hand, considering three levels of priority (low, medium, and high), we observe no difference in the BFT.</p><p>Conclusion: To the best of our knowledge, this is the first study using hierarchical Bayes to extrapolate results from multiple projects and assess the global effect of different attributes on the BFT. We use this methodology to gain insight on how links, priority, and code-churn size impact the BFT. On top of that, our posteriors can be used as a prior to analyze novel projects, potentially young and scarce on data. We also believe our methodology can be reused for other generalization studies in empirical software engineering. © 2022 Association for Computing Machinery.</p>",https://bth.diva-portal.org/smash/get/diva2:1709349/FULLTEXT01.pdf
Laiq_177_2022,"Laiq, Muhammad [miq] [0000-0002-5964-5554] (Blekinge Tekniska Högskola [16500], Fakulteten för datavetenskaper [16801], Institutionen för programvaruteknik [16805]);Ali, Nauman bin [nal] [0000-0001-7266-5632] (Blekinge Tekniska Högskola [16500], Fakulteten för datavetenskaper [16801], Institutionen för programvaruteknik [16805]);Börstler, Jürgen [jub] [0000-0003-0639-4234] (Blekinge Tekniska Högskola [16500], Fakulteten för datavetenskaper [16801], Institutionen för programvaruteknik [16805]);Engström, Emelie (Lund University)",2022,Early Identification of Invalid Bug Reports in Industrial Settings – A Case Study,"<p>Software development companies spend considerable time resolving bug reports. However, bug reports might be invalid, i.e., not point to a valid flaw. Expensive resources and time might be expended on invalid bug reports before discovering that they are invalid. In this case study, we explore the impact of invalid bug reports and develop and assess the use of machine learning (ML) to indicate whether a bug report is likely invalid. We found that about 15% of bug reports at the case company are invalid, and that their resolution time is similar to valid bug reports. Among the ML-based techniques we used, logistic regression and SVM show promising results. In the feedback, practitioners indicated an interest in using the tool to identify invalid bug reports at early stages. However, they emphasized the need to improve the explainability of ML-based recommendations and to reduce the maintenance cost of the tool. © 2022, The Author(s), under exclusive license to Springer Nature Switzerland AG.</p>",
Madeyski_188_2023,"Madeyski, Lech [lmd] [0000-0003-3907-3357] (Blekinge Tekniska Högskola [16500], Fakulteten för datavetenskaper [16801], Institutionen för programvaruteknik [16805]);Lewowski, Tomasz (Wroclaw University of Science and Technology, POL)",2023,Detecting code smells using industry-relevant data,"<p>Context: Code smells are patterns in source code associated with an increased defect rate and a higher maintenance effort than usual, but without a clear definition. Code smells are often detected using rules hard-coded in detection tools. Such rules are often set arbitrarily or derived from data sets tagged by reviewers without the necessary industrial know-how. Conclusions from studying such data sets may be unreliable or even harmful, since algorithms may achieve higher values of performance metrics on them than on models tagged by experts, despite not being industrially useful. Objective: Our goal is to investigate the performance of various machine learning algorithms for automated code smell detection trained on code smell data set(MLCQ) derived from actively developed and industry-relevant projects and reviews performed by experienced software developers. Method: We assign the severity of the smell to the code sample according to a consensus between the severities assigned by the reviewers, use the Matthews Correlation Coefficient (MCC) as our main performance metric to account for the entire confusion matrix, and compare the median value to account for non-normal distributions of performance. We compare 6720 models built using eight machine learning techniques. The entire process is automated and reproducible. Results: Performance of compared techniques depends heavily on analyzed smell. The median value of our performance metric for the best algorithm was 0.81 for Long Method, 0.31 for Feature Envy, 0.51 for Blob, and 0.57 for Data Class. Conclusions: Random Forest and Flexible Discriminant Analysis performed the best overall, but in most cases the performance difference between them and the median algorithm was no more than 10% of the latter. The performance results were stable over multiple iterations. Although the F-score omits one quadrant of the confusion matrix (and thus may differ from MCC), in code smell detection, the actual differences are minimal. © 2022 Elsevier B.V.</p>",
Koyyada_173_2022,"Koyyada, Sai Pranav (Blekinge Tekniska Högskola [16500]) (student);Deshmukh, Denim (Blekinge Tekniska Högskola [16500]) (student);Badampudi, Deepika [deb] [0000-0002-6215-1774] (Blekinge Tekniska Högskola [16500], Fakulteten för datavetenskaper [16801], Institutionen för programvaruteknik [16805]);Ahmadi Mehri, Vida [vax] [0000-0002-0128-4127] (Blekinge Tekniska Högskola [16500], Fakulteten för datavetenskaper [16801], Institutionen för datavetenskap [881506]) (City Network International AB);Usman, Muhammad [muu] [0000-0002-8132-0107] (Blekinge Tekniska Högskola [16500], Fakulteten för datavetenskaper [16801], Institutionen för programvaruteknik [16805])",2022,Towards automated open source assessment - An empirical study,"<p>The open source software (OSS) assessment has become important given the increased adoption of OSS in commercial product development. Researchers proposed many OSS assessment models. However, little is known about the industrial relevance of the models. In this study, we proposed an automated tool based on the OSS assessment attributes identified together with a European cloud provider company. We analyzed 51 repositories to observe patterns in maintenance activities over their lifetime (from inception to the latest release). Based on the analysis, we propose a novel approach for evaluating the maturity of the OSS project. Finally, we assessed the usefulness of our automated solution in a pilot study. © 2022 Copyright for this paper by its authors. Use permitted under Creative Commons License Attribution 4.0 International (CC BY 4.0).</p>",
Steidl_290_2023,"Steidl, Monika [0000-0002-3410-7637] (University Innsbruck,  Austria.);Felderer, Michael [mfd] [0000-0003-3818-4442] (Blekinge Tekniska Högskola [16500], Fakulteten för datavetenskaper [16801], Institutionen för programvaruteknik [16805]);Ramler, Rudolf (Software Competence Center Hagenberg GmbH SCCH,  Austria.)",2023,The pipeline for the continuous development of artificial intelligence models-Current state of research and practice,"<p>Companies struggle to continuously develop and deploy Artificial Intelligence (AI) models to complex production systems due to AI characteristics while assuring quality. To ease the development process, continuous pipelines for AI have become an active research area where consolidated and in-depth analysis regarding the terminology, triggers, tasks, and challenges is required.This paper includes a Multivocal Literature Review (MLR) where we consolidated 151 relevant formal and informal sources. In addition, nine-semi structured interviews with participants from academia and industry verified and extended the obtained information. Based on these sources, this paper provides and compares terminologies for Development and Operations (DevOps) and Continuous Integration (CI)/Continuous Delivery (CD) for AI, Machine Learning Operations (MLOps), (end-to-end) lifecycle management, and Continuous Delivery for Machine Learning (CD4ML). Furthermore, the paper provides an aggregated list of potential triggers for reiterating the pipeline, such as alert systems or schedules. In addition, this work uses a taxonomy creation strategy to present a consolidated pipeline comprising tasks regarding the continuous development of AI. This pipeline consists of four stages: Data Handling, Model Learning, Software Development and System Operations. Moreover, we map challenges regarding pipeline implementation, adaption, and usage for the continuous development of AI to these four stages.(c) 2023 The Authors. Published by Elsevier Inc. This is an open access article under the CC BY license (http://creativecommons.org/licenses/by/4.0/).</p>",https://bth.diva-portal.org/smash/get/diva2:1755645/FULLTEXT01.pdf
Flyckt_83_2023,"Flyckt, Jonatan (Jonkoping University);Andersson, Filip (Jonkoping University);Westphal, Florian (Jonkoping University);Mansson, Andreas (Saab AB, Training & Simulation, Huskvarna, Sweden);Lavesson, Niklas [nla] [0000-0002-0535-1761] (Blekinge Tekniska Högskola [16500], Fakulteten för datavetenskaper [16801], Institutionen för programvaruteknik [16805])",2023,Explaining rifle shooting factors through multi-sensor body tracking,"<p>There is a lack of data-driven training instructions for sports shooters, as instruction has commonly been based on subjective assessments. Many studies have correlated body posture and balance to shooting performance in rifle shooting tasks, but have mostly focused on single aspects of postural control. This study has focused on finding relevant rifle shooting factors by examining the entire body over sequences of time. A data collection was performed with 13 human participants carrying out live rifle shooting scenarios while being recorded with multiple body tracking sensors. A pre-processing pipeline produced a novel skeleton sequence representation, which was used to train a transformer model. The predictions from this model could be explained on a per sample basis using the attention mechanism, and visualised in an interactive format for humans to interpret. It was possible to separate the different phases of a shooting scenario from body posture with a high classification accuracy (80%). Shooting performance could be detected to an extent by separating participants using their strong and weak shooting hand. The dataset and pre-processing pipeline, as well as the techniques for generating explainable predictions presented in this study have laid the groundwork for future research in the sports shooting domain.</p>",
Silva_276_2023,"Silva, Lakmal [lks] [0000-0002-5027-9316] (Blekinge Tekniska Högskola [16500], Fakulteten för datavetenskaper [16801], Institutionen för programvaruteknik [16805]) (Ericsson AB, Karlskrona, Sweden);Unterkalmsteiner, Michael [mun] [0000-0003-4118-0952] (Blekinge Tekniska Högskola [16500], Fakulteten för datavetenskaper [16801], Institutionen för programvaruteknik [16805]);Wnuk, Krzysztof [krw] [0000-0003-3567-9300] (Blekinge Tekniska Högskola [16500], Fakulteten för datavetenskaper [16801], Institutionen för programvaruteknik [16805])",2023,Towards identifying and minimizing customer-facing documentation debt,"<p><strong>Background:</strong> Software documentation often struggles to catch up with the pace of software evolution. The lack of correct, complete, and up-to-date documentation results in an increasing number of documentation defects which could introduce delays in integrating software systems. In our previous study on a bug analysis tool called MultiDimEr, we provided evidence that documentation-related defects contribute to a significant number of bug reports.</p><p><strong>Aims:</strong> First, we want to identify documentation defect types contributing to documentation defects and thereby identifying documentation debt. Secondly, we aim to find pragmatic solutions to minimize most common documentation defects to pay off the documentation debt in the long run.</p><p><strong>Method:</strong> We investigated documentation defects related to an industrial software system. First, we looked at the types of different documentation and associated bug reports. We categorized the defects according to an existing documentation defect taxonomy.</p><p><strong>Results:</strong> Based on a sample of 101 defects, we found that a majority of defects are caused by documentation defects falling into the Information Content (What) category (86). Within this category, the documentation defect types Erroneous code examples (23), Missing documentation (35), and Outdated content (19) contributed to most of the documentation defects. We propose to adapt two solutions to mitigate these types of documentation defects.</p><p><strong>Conclusions:</strong> In practice, documentation debt can easily go undetected since a large share of resources and focus is dedicated to deliver high-quality software. This study provides evidence that documentation debt can contribute to increase in maintenance costs due to the number of documentation defects. We suggest to adapt two main solutions to tackle documentation debt by implementing (i) Dynamic Documentation Generation (DDG) and/or (ii) Automated Documentation Testing (ADT), which are both based on defining a single and robust information source for documentation.</p>",https://bth.diva-portal.org/smash/get/diva2:1760479/FULLTEXT01.pdf
Rainer_252_2023,"Rainer, Austen (Queen's University Belfast, United Kingdom);Wohlin, Claes [cwo] [0000-0003-0460-5253] (Blekinge Tekniska Högskola [16500], Fakulteten för datavetenskaper [16801], Institutionen för programvaruteknik [16805])",2023,Case study identification : A trivial indicator outperforms human classifiers,"<p>Context: The definition and term “case study” are not being applied consistently by software engineering researchers. We previously developed a trivial “smell indicator” to help detect the misclassification of primary studies as case studies. Objective: To evaluate the performance of the indicator. Methods: We compare the performance of the indicator against human classifiers for three datasets, two datasets comprising classifications by both authors of systematic literature studies and primary studies, and one dataset comprising only primary-study author classifications. Results: The indicator outperforms the human classifiers for all datasets. Conclusions: The indicator is successful because human classifiers “fail” to properly classify their own, and others’, primary studies. Consequently, reviewers of primary studies and authors of systematic literature studies could use the classifier as a “sanity” check for primary studies. Moreover, authors might use the indicator to double-check how they classified a study, as part of their analysis, and prior to submitting their manuscript for publication. We challenge the research community to both beat the indicator, and to improve its ability to identify true case studies. © 2023 The Author(s)</p>",https://bth.diva-portal.org/smash/get/diva2:1761963/FULLTEXT01.pdf
Sarika_269_2023,"Sarika, Pawan Kumar (Ericsson AB, Stockholm, Sweden);Badampudi, Deepika [deb] [0000-0002-6215-1774] (Blekinge Tekniska Högskola [16500], Fakulteten för datavetenskaper [16801], Institutionen för programvaruteknik [16805]);Josyula, Sai Prashanth [SPJ] [0000-0001-8377-8536] (Blekinge Tekniska Högskola [16500], Fakulteten för datavetenskaper [16801], Institutionen för datavetenskap [881506]);Usman, Muhammad [muu] [0000-0002-8132-0107] (Blekinge Tekniska Högskola [16500], Fakulteten för datavetenskaper [16801], Institutionen för programvaruteknik [16805])",2023,Automating Microservices Test Failure Analysis using Kubernetes Cluster Logs,"<p>Kubernetes is a free, open-source container orchestration system for deploying and managing Docker containers that host microservices. Kubernetes cluster logs help in determining the reason for the failure. However, as systems become more complex, identifying failure reasons manually becomes more difficult and time-consuming. This study aims to identify effective and efficient classification algorithms to automatically determine the failure reason. We compare five classification algorithms, Support Vector Machines, K-Nearest Neighbors, Random Forest, Gradient Boosting Classifier, and Multilayer Perceptron. Our results indicate that Random Forest produces good accuracy while requiring fewer computational resources than other algorithms. © 2023 Owner/Author.</p>",https://bth.diva-portal.org/smash/get/diva2:1777850/FULLTEXT01.pdf
Silvander_279_2023,"Silvander, Johan [jsn] [0000-0003-0396-1993] (Blekinge Tekniska Högskola [16500], Fakulteten för datavetenskaper [16801], Institutionen för programvaruteknik [16805]);Singh, Shailesh Pratap [sip] [0000-0002-2015-407x] (Blekinge Tekniska Högskola [16500], Fakulteten för datavetenskaper [16801], Institutionen för datavetenskap [881506])",2023,Validating Trust in Human Decisions to Improve Expert Models Based on Small Data Sets,"<p>When a model is built based on expert knowledge, a small data set will, in many cases, form the base for the model. It must be possible to validate the trustworthiness and model improvement potential of the provided information from humans or machines. In this study, we have investigated how to evaluate the information from humans to improve the model itself. We used evaluation research and collected the research data with the help of focus group interviews and questionnaires. The result of the study suggests a way to determine the trustworthiness of answers from humans and how to understand if these answers indicate a change to the underlying expert model. The introduction of divergence, and candidate areas, made it possible to evaluate the trustworthiness and changes to the expert model. These were deemed valuable by practitioners.</p>",
Laiq_176_2023,"Laiq, Muhammad [miq] [0000-0002-5964-5554] (Blekinge Tekniska Högskola [16500], Fakulteten för datavetenskaper [16801], Institutionen för programvaruteknik [16805]);Ali, Nauman bin [nal] [0000-0001-7266-5632] (Blekinge Tekniska Högskola [16500], Fakulteten för datavetenskaper [16801], Institutionen för programvaruteknik [16805]);Börstler, Jürgen [jub] [0000-0003-0639-4234] (Blekinge Tekniska Högskola [16500], Fakulteten för datavetenskaper [16801], Institutionen för programvaruteknik [16805]);Engström, Emelie (Lund University)",2023,A data-driven approach for understanding invalid bug reports : An industrial case study,"<p>Context: Bug reports created during software development and maintenance do not always describe deviations from a system's valid behavior. Such invalid bug reports may consume significant resources and adversely affect the prioritization and resolution of valid bug reports. There is a need to identify preventive actions to reduce the inflow of invalid bug reports. Existing research has shown that manually analyzing invalid bug report descriptions provides cues regarding preventive actions. However, such a manual approach is not cost-effective due to the time required to analyze a sufficiently large number of bug reports needed to identify useful patterns. Furthermore, the analysis needs to be repeated as the underlying causes of invalid bug reports change over time. Objective: In this study, we propose and evaluate the use of Latent Dirichlet Allocation (LDA), a topic modeling approach, to support practitioners in suggesting preventive actions to avoid the creation of similar invalid bug reports in the future. Method: In an industrial case study, we first manually analyzed descriptions of invalid bug reports to identify common patterns in their descriptions. We further investigated to what extent LDA can support this manual process. We used expert-based validation to evaluate the relevance of identified common patterns and their usefulness in suggesting preventive measures. Results: We found that invalid bug reports have common patterns that are perceived as relevant, and they can be used to devise preventive measures. Furthermore, the identification of common patterns can be supported with automation. Conclusion: Using LDA, practitioners can effectively identify representative groups of bug reports (i.e., relevant common patterns) from a large number of bug reports and analyze them further to devise preventive measures. © 2023 The Author(s)</p>",https://bth.diva-portal.org/smash/get/diva2:1789165/FULLTEXT01.pdf
Laiq_174_2023,"Laiq, Muhammad [miq] [0000-0002-5964-5554] (Blekinge Tekniska Högskola [16500], Fakulteten för datavetenskaper [16801], Institutionen för programvaruteknik [16805])",2023,An Intelligent Tool for Classifying Issue Reports,"<p>A considerable amount of issue reports are submitted daily in large-scale software development. Manually reviewing and classifying each issue report is challenging and error-prone. Thus, to assist practitioners, in this paper, we propose and evaluate an automatic supervised machine learning-based approach that can automatically predict the newly submitted issue report type (i.e., bug, feature, question, or documentation). We applied the supervised machine learning-based approach to over 1.4 million issue reports data from real open-source projects. We performed our experiments using Stochastic Gradient Descent (SGD)-based classifier and achieved an F1 micro average score of 0.8523. © 2023 IEEE.</p>",https://bth.diva-portal.org/smash/get/diva2:1791346/FULLTEXT01.pdf
