citationid,Name,Year,Title,Abstract,FullTextLink
Fischbach_79_2021,"Fischbach, Jannik (Qualicen GmbH, DEU);Frattini, Julian [juf] [0000-0003-3995-6125] (Blekinge Tekniska Högskola [16500], Fakulteten för datavetenskaper [16801], Institutionen för programvaruteknik [16805]);Vogelsang, Andreas (University of Cologne, DEU)",2021,CiRA : A Tool for the Automatic Detection of Causal Relationships in Requirements Artifacts,"<p>Requirements often specify the expected system behavior by using causal relations (e.g., If A, then B). Automatically extracting these relations supports, among others, two prominent RE use cases: Automatic test case derivation and dependency detection between requirements. However, existing tools fail to extract causality from natural language with reasonable performance. In this paper, we present our tool CiRA (Causality detection in Requirements Artifacts), which represents a first step towards automatic causality extraction from requirements. We evaluate CiRA on a publicly available data set of 61 acceptance criteria (causal: 32; non-causal: 29) describing the functionality of the German Corona-Warn-App. We achieve a macro1 score of 83 %, which corroborates the feasibility of our approach. © 2021 CEUR-WS. All rights reserved.</p>",https://bth.diva-portal.org/smash/get/diva2:1556389/FULLTEXT01.pdf
Chuprina_52_2021,"Chuprina, Tatiana;Mendez, Daniel [dmz] [0000-0003-0619-6027] (Blekinge Tekniska Högskola [16500], Fakulteten för datavetenskaper [16801], Institutionen för programvaruteknik [16805]);Wnuk, Krzysztof [krw] [0000-0003-3567-9300] (Blekinge Tekniska Högskola [16500], Fakulteten för datavetenskaper [16801], Institutionen för programvaruteknik [16805])",2021,Towards Artefact-based Requirements Engineering for Data-Centric Systems,"<p>Many modern software-intensive systems employ artificial intelligence / machine-learning (AI/ML) components and are, thus, inherently data-centric. The behaviour of such systems depends on typically large amounts of data processed at run-Time rendering such non-deterministic systems as complex. This complexity growth affects our understanding on needs and practices in Requirements Engineering (RE). There is, however, still little guidance on how to handle requirements for such systems effectively: What are, for example, typical quality requirements classes What modelling concepts do we rely on or which levels of abstraction do we need to consider In fact, how to integrate such concepts into approaches for a more traditional RE still needs profound investigations. In this research preview paper, we report on ongoing efforts to establish an artefact-based RE approach for the development of datacentric systems (DCSs). To this end, we sketch a DCS development process with the newly proposed requirements categories and data-centric artefacts and briefly report on an ongoing investigation of current RE challenges in industry developing data-centric systems. © 2021 CEUR-WS. All rights reserved.</p>",https://bth.diva-portal.org/smash/get/diva2:1556403/FULLTEXT01.pdf
Devagiri_61_2021,"Devagiri, Vishnu Manasa [vmd] [0000-0003-3371-5347] (Blekinge Tekniska Högskola [16500], Fakulteten för datavetenskaper [16801], Institutionen för datavetenskap [881506]);Boeva, Veselka [vbx] [0000-0003-3128-191x] (Blekinge Tekniska Högskola [16500], Fakulteten för datavetenskaper [16801], Institutionen för datavetenskap [881506]);Abghari, Shahrooz [sab] [0000-0002-3010-8798] (Blekinge Tekniska Högskola [16500], Fakulteten för datavetenskaper [16801], Institutionen för datavetenskap [881506]);Basiri, Fahrad (iquest AB, SWE);Lavesson, Niklas [nla] [0000-0002-0535-1761] (Blekinge Tekniska Högskola [16500], Fakulteten för datavetenskaper [16801], Institutionen för programvaruteknik [16805])",2021,Multi-view data analysis techniques for monitoring smart building systems,"<p>In smart buildings, many different systems work in coordination to accomplish their tasks. In this process, the sensors associated with these systems collect large amounts of data generated in a streaming fashion, which is prone to concept drift. Such data are heterogeneous due to the wide range of sensors collecting information about different characteristics of the monitored systems. All these make the monitoring task very challenging. Traditional clustering algorithms are not well equipped to address the mentioned challenges. In this work, we study the use of MV Multi-Instance Clustering algorithm for multi-view analysis and mining of smart building systems’ sensor data. It is demonstrated how this algorithm can be used to perform contextual as well as integrated analysis of the systems. Various scenarios in which the algorithm can be used to analyze the data generated by the systems of a smart building are examined and discussed in this study. In addition, it is also shown how the extracted knowledge can be visualized to detect trends in the systems’ behavior and how it can aid domain experts in the systems’ maintenance. In the experiments conducted, the proposed approach was able to successfully detect the deviating behaviors known to have previously occurred and was also able to identify some new deviations during the monitored period. Based on the results obtained from the experiments, it can be concluded that the proposed algorithm has the ability to be used for monitoring, analysis, and detecting deviating behaviors of the systems in a smart building domain. © 2021 by the authors. Licensee MDPI, Basel, Switzerland.</p>",https://bth.diva-portal.org/smash/get/diva2:1605257/FULLTEXT01.pdf
Henao_134_2021,"Henao, Pablo Restrepo (Technical University of Munich, DEU);Fischbach, Jannik (Qualicen GmbH, DEU);Spies, Dominik (Qualicen GmbH, DEU);Frattini, Julian [juf] [0000-0003-3995-6125] (Blekinge Tekniska Högskola [16500], Fakulteten för datavetenskaper [16801], Institutionen för programvaruteknik [16805]);Vogelsang, Anderas (University of Cologne, DEU)",2021,Transfer Learning for Mining Feature Requests and Bug Reports from Tweets and App Store Reviews,"<p>Identifying feature requests and bug reports in user comments holds great potential for development teams. However, automated mining of RE-related information from social media and app stores is challenging since (1) about 70% of user comments contain noisy, irrelevant information, (2) the amount of user comments grows daily making manual analysis unfeasible, and (3) user comments are written in different languages. Existing approaches build on traditional machine learning (ML) and deep learning (DL), but fail to detect feature requests and bug reports with high Recall and acceptable Precision which is necessary for this task. In this paper, we investigate the potential of transfer learning (TL) for the classification of user comments. Specifically, we train both monolingual and multilingual BERT models and compare the performance with state-of-the-art methods. We found that monolingual BERT models outperform existing baseline methods in the classification of English App Reviews as well as English and Italian Tweets. However, we also observed that the application of heavyweight TL models does not necessarily lead to better performance. In fact, our multilingual BERT models perform worse than traditional ML methods. © 2021 IEEE.</p>",
Bennin_35_2022,"Bennin, Kwabena Ebo [0000-0001-9140-9271] (Wageningen Univ & Res, NLD);Tahir, Amjed [0000-0001-9454-1366] (Massey University, NZL);MacDonell, Stephen G. (University of Otago, NZL);Börstler, Jürgen [jub] [0000-0003-0639-4234] (Blekinge Tekniska Högskola [16500], Fakulteten för datavetenskaper [16801], Institutionen för programvaruteknik [16805]) (Blekinge Institute of Technology  Karlskrona Sweden)",2022,An empirical study on the effectiveness of data resampling approaches for cross‐project software defect prediction,"<p>Cross‐project defect prediction (CPDP), where data from different software projects are used to predict defects, has been proposed as a way to provide data for software projects that lack historical data. Evaluations of CPDP models using the Nearest Neighbour (NN)Filter approach have shown promising results in recent studies. A key challenge with defect‐prediction datasets is class imbalance, that is, highly skewed datasets where nonbuggy modules dominate the buggy modules. In the past, data resampling approaches have been applied to within‐projects defect prediction models to help alleviate the negative effects of class imbalance in the datasets. To address the class imbalance issue in CPDP, the authors assess the impact of data resampling approaches on CPDP models after the NN Filter is applied. The impact on prediction performance of five oversampling approaches (MAHAKIL, SMOTE, Borderline‐SMOTE, Random Oversamplingand ADASYN) and three undersampling approaches (Random Undersampling, Tomek Links and One‐sided selection) is investigated and results are compared to approaches without data resampling. The authors examined six defect prediction models on34 datasets extracted from the PROMISE repository. The authors' results show that there is a significant positive effect of data resampling on CPDP performance, suggesting that software quality teams and researchers should consider applying data resampling approaches for improved recall (pd) and g‐measure prediction performance. However, if the goal is to improve precision and reduce false alarm (pf) then data resampling approaches should be avoided.</p>",https://bth.diva-portal.org/smash/get/diva2:1617148/FULLTEXT01.pdf
Frattini_95_2023,"Frattini, Julian [juf] [0000-0003-3995-6125] (Blekinge Tekniska Högskola [16500], Fakulteten för datavetenskaper [16801], Institutionen för programvaruteknik [16805]);Fischbach, Jannik (Qualicen GmbH, GER);Mendez, Daniel [dmz] [0000-0003-0619-6027] (Blekinge Tekniska Högskola [16500], Fakulteten för datavetenskaper [16801], Institutionen för programvaruteknik [16805]);Unterkalmsteiner, Michael [mun] [0000-0003-4118-0952] (Blekinge Tekniska Högskola [16500], Fakulteten för datavetenskaper [16801], Institutionen för programvaruteknik [16805]);Vogelsang, Andreas (University of Cologne, GER);Wnuk, Krzysztof [krw] [0000-0003-3567-9300] (Blekinge Tekniska Högskola [16500], Fakulteten för datavetenskaper [16801], Institutionen för programvaruteknik [16805])",2023,"Causality in requirements artifacts : prevalence, detection, and impact","<p>Causal relations in natural language (NL) requirements convey strong, semantic information. Automatically extracting such causal information enables multiple use cases, such as test case generation, but it also requires to reliably detect causal relations in the first place. Currently, this is still a cumbersome task as causality in NL requirements is still barely understood and, thus, barely detectable. In our empirically informed research, we aim at better understanding the notion of causality and supporting the automatic extraction of causal relations in NL requirements. In a first case study, we investigate 14.983 sentences from 53 requirements documents to understand the extent and form in which causality occurs. Second, we present and evaluate a tool-supported approach, called CiRA, for causality detection. We conclude with a second case study where we demonstrate the applicability of our tool and investigate the impact of causality on NL requirements. The first case study shows that causality constitutes around 28 % of all NL requirements sentences. We then demonstrate that our detection tool achieves a macro-F 1 score of 82 % on real-world data and that it outperforms related approaches with an average gain of 11.06 % in macro-Recall and 11.43 % in macro-Precision. Finally, our second case study corroborates the positive correlations of causality with features of NL requirements. The results strengthen our confidence in the eligibility of causal relations for downstream reuse, while our tool and publicly available data constitute a first step in the ongoing endeavors of utilizing causality in RE and beyond. © 2022, The Author(s).</p>",https://bth.diva-portal.org/smash/get/diva2:1640668/FULLTEXT01.pdf
Jasarevic_151_2021,"Jasarevic, Mirza [mjc] (Blekinge Tekniska Högskola [16500], Fakulteten för datavetenskaper [16801], Institutionen för programvaruteknik [16805]);Boeva, Veselka [vbx] [0000-0003-3128-191x] (Blekinge Tekniska Högskola [16500], Fakulteten för datavetenskaper [16801], Institutionen för datavetenskap [881506]);Sjölin, Fredrik (Municipality of Karlskrona, SWE);Gramstad, Per-Olav (Municipality of Karlskrona, SWE)",2021,Understanding Traffic Cruising Causation Via Parking Data Enhancement,"<p>This study is devoted to understanding traffic cruising causation through exploring and enhancing parking data. Five recent (2017-2020) studies modeling parking congestion relied on occupancy as their only parking lot feature, then compared modeling techniques using this feature, to find the best performance. However, recently some computer scientists pointed out that it is more effective for the computer science community to focus more on data preparation for performance improvements, rather than exclusively comparing modeling techniques. This inspired us to add more parking lot features and evaluate them, to investigate how they should be composed into a congestion score, acting as a more accurate picture of reality. The score is then compared to the performance of a version where occupancy is the only parking lot feature. An experimental case study is designed in three parts. The first measures how the features should be summed into a score according to drivers' expectations. The second analyzes how much data can be reused from the real data, and whether spatial or temporal comparisons are better for data synthesis of parking data. The third part compares the performance of the score against the occupancy-only version using k-means clustering algorithm and dynamic time warping distance. The experimental results show performance improvements in all spatial and temporal categories, and increasing improvement as the sample sizes grow. © 2021 IEEE.</p>",https://bth.diva-portal.org/smash/get/diva2:1645931/FULLTEXT01.pdf
Adigun_7_2022,"Adigun, Jubril Gbolahan (University of Innsbruck, DEU);Camilli, Matteo (Free University of Bozen–Bolzano, ITA);Felderer, Michael [mfd] [0000-0003-3818-4442] (Blekinge Tekniska Högskola [16500], Fakulteten för datavetenskaper [16801], Institutionen för programvaruteknik [16805]);Giusti, Andrea (Fraunhofer Italia Research, ITA);Matt, Dominik T. (Free University of Bozen–Bolzano, ITA);Perini, Anna (University of Trento, ITA);Russo, Barbara (Free University of Bozen–Bolzano, ITA);Susi, Angelo (Fondazione Bruno Kessler, ITA)",2022,Collaborative Artificial Intelligence Needs Stronger Assurances Driven by Risks,"<p>Collaborative artificial intelligence systems (CAISs) aim to work with humans in a shared space to achieve a common goal, but this can pose hazards that could harm human beings. We identify emerging problems in this context and report our vision of and progress toward a risk-driven assurance process for CAISs.</p>",
Singh_285_2022,"Singh, Shailesh Pratap [sip] [0000-0002-2015-407X] (Blekinge Tekniska Högskola [16500], Fakulteten för datavetenskaper [16801], Institutionen för datavetenskap [881506]);Ali, Nauman bin [nal] [0000-0001-7266-5632] (Blekinge Tekniska Högskola [16500], Fakulteten för datavetenskaper [16801], Institutionen för programvaruteknik [16805]);Lundberg, Lars [llu] (Blekinge Tekniska Högskola [16500], Fakulteten för datavetenskaper [16801], Institutionen för datavetenskap [881506])",2022,Smart and Adaptive Architecture for a Dedicated Internet of Things Network Comprised of Diverse Entities : A Proposal and Evaluation,"<p>Advances in 5G and the Internet of Things (IoT) have to cater to the diverse and varying needs of different stakeholders, devices, sensors, applications, networks, and access technologies that come together for a dedicated IoT network for a synergistic purpose. Therefore, there is a need for a solution that can assimilate the various requirements and policies to dynamically and intelligently orchestrate them in the dedicated IoT network. Thus we identify and describe a representative industry-relevant use case for such a smart and adaptive environment through interviews with experts from a leading telecommunication vendor. We further propose and evaluate candidate architectures to achieve dynamic and intelligent orchestration in such a smart environment using a systematic approach for architecture design and by engaging six senior domain and IoT experts. The candidate architecture with an adaptive and intelligent element (“Smart AAA agent”) was found superior for modifiability, scalability, and performance in the assessments. This architecture also explores the enhanced role of authentication, authorization, and accounting (AAA) and makes the base for complete orchestration. The results indicate that the proposed architecture can meet the requirements for a dedicated IoT network, which may be used in further research or as a reference for industry solutions. © 2022 by the authors. Licensee MDPI, Basel, Switzerland.</p>",https://bth.diva-portal.org/smash/get/diva2:1654986/FULLTEXT01.pdf
Tuzun_316_2022,"Tuzun, Eray (Bilkent University, TUR);Erdogmus, Hakan (Carnegie Mellon University, USA);Baldassarre, Maria Teresa (University of Bari, ITA);Felderer, Michael [mfd] [0000-0003-3818-4442] (Blekinge Tekniska Högskola [16500], Fakulteten för datavetenskaper [16801], Institutionen för programvaruteknik [16805]);Feldt, Robert [rfd] [0000-0002-5179-4205] (Blekinge Tekniska Högskola [16500], Fakulteten för datavetenskaper [16801], Institutionen för programvaruteknik [16805]);Turhan, Burak (University of Oulu, AUS)",2022,Ground-Truth Deficiencies in Software Engineering : When Codifying the Past Can Be Counterproductive,"<p>In software engineering, the objective function of human decision makers might be influenced by many factors. Relying on historical data as the ground truth may give rise to systems that automate software engineering decisions by mimicking past suboptimal behavior. We describe the problem and offer some strategies. ©IEEE.</p>",
Palma_229_2022,"Palma, Francis (Linnaeus University, SWE);Olsson, Tobias [0000-0003-1154-5308] (Linnaeus University, SWE);Wingkvist, Anna [0000-0002-0835-823X] (Linnaeus University, SWE);Gonzalez-Huerta, Javier [jgh] [0000-0003-1350-7030] (Blekinge Tekniska Högskola [16500], Fakulteten för datavetenskaper [16801], Institutionen för programvaruteknik [16805])",2022,Assessing the linguistic quality of REST APIs for IoT applications,"<p>Internet of Things (IoT) is a growing technology that relies on connected ‘things’ that gather data from peer devices and send data to servers via APIs (Application Programming Interfaces). The design quality of those APIs has a direct impact on their understandability and reusability. This study focuses on the linguistic design quality of REST APIs for IoT applications and assesses their linguistic quality by performing the detection of linguistic patterns and antipatterns in REST APIs for IoT applications. Linguistic antipatterns are considered poor practices in the naming, documentation, and choice of identifiers. In contrast, linguistic patterns represent best practices to APIs design. The linguistic patterns and their corresponding antipatterns are hence contrasting pairs. We propose the SARAv2 (Semantic Analysis of REST APIs version two) approach to perform syntactic and semantic analyses of REST APIs for IoT applications. Based on the SARAv2 approach, we develop the REST-Ling tool and empirically validate the detection results of nine linguistic antipatterns. We analyse 19 REST APIs for IoT applications. Our detection results show that the linguistic antipatterns are prevalent and the REST-Ling tool can detect linguistic patterns and antipatterns in REST APIs for IoT applications with an average accuracy of over 80%. Moreover, the tool performs the detection of linguistic antipatterns on average in the order of seconds, i.e., 8.396 s. We found that APIs generally follow good linguistic practices, although the prevalence of poor practices exists.</p>",https://bth.diva-portal.org/smash/get/diva2:1669152/FULLTEXT01.pdf
Zabardast_364_2022,"Zabardast, Ehsan [ehz] [0000-0002-1729-5154] (Blekinge Tekniska Högskola [16500], Fakulteten för datavetenskaper [16801], Institutionen för programvaruteknik [16805]);Gonzalez-Huerta, Javier [jgh] [0000-0003-1350-7030] (Blekinge Tekniska Högskola [16500], Fakulteten för datavetenskaper [16801], Institutionen för programvaruteknik [16805]);Tanveer, Binish [bta] [0000-0003-2300-068x] (Blekinge Tekniska Högskola [16500], Fakulteten för datavetenskaper [16801], Institutionen för programvaruteknik [16805])",2022,Ownership vs Contribution : Investigating the Alignment between Ownership and Contribution,"<p>Software development is a collaborative endeavour. Organisations that develop software assign modules to different teams, i.e., teams own their modules and are responsible for them. These modules are rarely isolated, meaning that there exist dependencies among them. Therefore, other teams might often contribute to developing modules they do not own. The contribution can be, among other types, in the form of code authorship, code review, and issue detection. This research presents a model to investigate the alignment between module ownership and contribution and the preliminary results of an industrial case study to evaluate the model in practice. Our model uses seven metrics to assess teams' contributions. Initial results suggest that the model correctly identifies misalignment between ownership and contribution. The detection of misalignment between ownership and contribution is the first step towards investigating the impact it might have on the faster accumulation of Technical Debt. © 2022 IEEE.</p>",https://bth.diva-portal.org/smash/get/diva2:1676639/FULLTEXT01.pdf
Foidl_86_2022,"Foidl, Harald (University of Innsbruck, AUT);Felderer, Michael [mfd] [0000-0003-3818-4442] (Blekinge Tekniska Högskola [16500], Fakulteten för datavetenskaper [16801], Institutionen för programvaruteknik [16805]);Ramler, Rudolf (Software Competence Center Hagenberg GmbH, AUT)",2022,"Data Smells : Categories, Causes and Consequences, and Detection of Suspicious Data in AI-based Systems","<p>High data quality is fundamental for today's AI-based systems. However, although data quality has been an object of research for decades, there is a clear lack of research on potential data quality issues (e.g., ambiguous, extraneous values). These kinds of issues are latent in nature and thus often not obvious. Nevertheless, they can be associated with an increased risk of future problems in AI-based systems (e.g., technical debt, data-induced faults). As a counterpart to code smells in software engineering, we refer to such issues as Data Smells. This article conceptualizes data smells and elaborates on their causes, consequences, detection, and use in the context of AI-based systems. In addition, a catalogue of 36 data smells divided into three categories (i.e., Believability Smells, Understandability Smells, Consistency Smells) is presented. Moreover, the article outlines tool support for detecting data smells and presents the result of an initial smell detection on more than 240 real-world datasets. </p>",
Silva_275_2022,"Silva, Lakmal [lks] [0000-0002-5027-9316] (Blekinge Tekniska Högskola [16500], Fakulteten för datavetenskaper [16801], Institutionen för programvaruteknik [16805]) (Ericsson AB, Sweden);Unterkalmsteiner, Michael [mun] [0000-0003-4118-0952] (Blekinge Tekniska Högskola [16500], Fakulteten för datavetenskaper [16801], Institutionen för programvaruteknik [16805]);Wnuk, Krzysztof [krw] [0000-0003-3567-9300] (Blekinge Tekniska Högskola [16500], Fakulteten för datavetenskaper [16801], Institutionen för programvaruteknik [16805])",2022,MultiDimEr : A Multi-Dimensional bug analyzEr,"<p>Background: Bugs and bug management consumes a significant amount of time and effort from software development organizations. A reduction in bugs can significantly improve the capacity for new feature development. Aims: We categorize and visualize dimensions of bug reports to identify accruing technical debt. This evidence can serve practitioners and decision makers not only as an argumentative basis for steering improvement efforts, but also as a starting point for root cause analysis, reducing overall bug inflow. Method: We implemented a tool, MultiDimEr, that analyzes and visualizes bug reports. The tool was implemented and evaluated at Ericsson. Results: We present our preliminary findings using the MultiDimEr for bug analysis, where we successfully identified components generating most of the bugs and bug trends within certain components. Conclusions: By analyzing the dimensions provided by MultiDimEr, we show that classifying and visualizing bug reports in different dimensions can stimulate discussions around bug hot spots as well as validating the accuracy of manually entered bug report attributes used in technical debt measurements such as fault slip through. © 2022 ACM.</p>",https://bth.diva-portal.org/smash/get/diva2:1687322/FULLTEXT02.pdf
