citationid,Name,Year,Title,Abstract,FullTextLink
LimayllaLunarejo_185_2020,"Limaylla Lunarejo, María Isabel (Universidade Federal do Piauí, BRA);Santos Neto, Pedro De Alcântara Dos (Universidade Federal do Piauí, BRA);Avelino, Guilherme (Universidade Federal do Piauí, BRA);Britto, Ricardo [rbr] [0000-0002-7220-9570] (Blekinge Tekniska Högskola [16500], Fakulteten för datavetenskaper [16801], Institutionen för programvaruteknik [16805]) (Ericsson AB)",2020,Automatic detection of usability smells in web applications running in mobile devices,"<p>Currently, the use of mobile devices, mainly smartphones, has been gradually increasing due to the increasing development of mobile technologies. However, it is often the case that web applications are not tested on mobile devices which has led to, among others, usability errors. Therefore, the importance of usability testing in mobile devices has been increasing, but it is costly and time-consuming; the use of these devices in many cases cannot be replicated solely in a laboratory, but it should be replicated in the field which is more complex to implement. In addition to these usability testing and to reduce the time and complexity of testing in these devices, we proposed an automatic approach to identify indicators of usability problems (Usability Smells). To do so, we implemented a process of pattern matching in the tool UseSkill and proposed Usability Smells and their corresponding patterns for this context. This tool uses the data from the interactions of the user with a Mobile Web Application, discovering Usability Smells. This new process was experimented in two study cases with two applications where it collected data of participants who used it on a mobile device (smartphone). The results obtained were promising in identifying usability smells in relation to usability problems. © 2020 ACM.</p>",
Petersen_246_2021,"Petersen, Kai [kps] [0000-0002-1532-8223] (Blekinge Tekniska Högskola [16500], Fakulteten för datavetenskaper [16801], Institutionen för programvaruteknik [16805]);Gerken, Jan M. (University of Applied Sciences Flensburg, DEU)",2021,#Covid-19 : An exploratory investigation of hashtag usage on Twitter,"<p>Background: The literature highlights Twitter as a vital instrument tool for health policy-makers for health communication and promotion. Furthermore, Twitter is a tool allowing us to understand the focus of people regarding a topic of interest. Objective: To provide health policy-makers with insights concerning key topics of interest in the Twitter community regarding Covid-19, and to support information search and health communication. Method: A total of 28.5M tweets have been retrieved, of which 6.9M tweets included hashtags. The data was analyzed using data science and natural language processing libraries. Qualitative analysis was performed using thematic analysis. Results: 907k different hashtags were used. Of these, only 1192 hashtags were used more than 1000 times. The qualitative analysis resulted in 13 themes. The top three themes regarding the number of hashtags used were related to Covid-19, identifying information, interventions, and geographical tagging. We explored the relationship between themes and showed how health practitioners can understand the communication in relation to specific topics expressed as hashtags (e.g., #stayhome). Conclusions: The results provide first insights for policy-makers and health practitioners to identify relevant tweets and to choose appropriate hashtags for health communication. The results also show that only with a limited number of Tweets (10 per day) health organizations could have been among the top users. © 2021 Elsevier B.V.</p>",https://bth.diva-portal.org/smash/get/diva2:1526064/FULLTEXT01.pdf
Olsson_226_2021,"Olsson, Thomas [thn] [0000-0002-2933-1925] (Blekinge Tekniska Högskola [16500], Fakulteten för datavetenskaper [16801], Institutionen för programvaruteknik [16805]) (RISE Reserach Institutes of Sweden, SWE);Wnuk, Krzysztof [krw] [0000-0003-3567-9300] (Blekinge Tekniska Högskola [16500], Fakulteten för datavetenskaper [16801], Institutionen för programvaruteknik [16805]);Jansen, Slinger (LUT University, FIN)",2021,A validated model for the scoping process of quality requirements : a multi-case study,"<p>Quality requirements are vital to developing successful software products. However, there exist evidence that quality requirements are managed mostly in an “ad hoc” manner and down-prioritized. This may result in insecure, unstable, slow products, and unhappy customers. We have developed a conceptual model for the scoping process of quality requirements – QREME – and an assessment model – Q-REPM – for companies to benchmark when evaluating and improving their quality requirements practices. Our model balances an upfront forward-loop with a data-driven feedback-loop. Furthermore, it addresses both strategic and operational decisions. We have evaluated the model in a multi-case study at two companies in Sweden and three companies in The Netherlands. We assessed the scoping process practices for quality requirements and provided improvement recommendations for which practices to improve. The study confirms the existence of the constructs underlying QREME. The companies perform, in the median, 24% of the suggested actions in Q-REPM. None of the companies work data-driven with their quality requirements, even though four out of five companies could technically do so. Furthermore, on the strategic level, quality requirements practices are not systematically performed by any of the companies. The conceptual model and assessment model capture a relevant view of the quality requirements practices and offer relevant improvement proposals. However, we believe there is a need for coupling quality requirements practices to internal and external success factors to motive companies to change their ways of working. We also see improvement potential in the area of business intelligence for QREME in selecting data sources and relevant stakeholders.</p>",https://bth.diva-portal.org/smash/get/diva2:1535203/FULLTEXT01.pdf
Wohlin_349_2021,"Wohlin, Claes [cwo] [0000-0003-0460-5253] (Blekinge Tekniska Högskola [16500], Fakulteten för datavetenskaper [16801], Institutionen för programvaruteknik [16805]);Papatheocharous, Efi (RISE Research Institutes of Sweden AB, SWE);Carlson, Jan (Mälardalen University, SWE);Petersen, Kai [kps] [0000-0002-1532-8223] (Blekinge Tekniska Högskola [16500], Fakulteten för datavetenskaper [16801], Institutionen för programvaruteknik [16805]);Alégroth, Emil [EAL] [0000-0001-7526-3727] (Blekinge Tekniska Högskola [16500], Fakulteten för datavetenskaper [16801], Institutionen för programvaruteknik [16805]);Axelsson, Jakob (Mälardalen University, SWE);Badampudi, Deepika [deb] [0000-0002-6215-1774] (Blekinge Tekniska Högskola [16500], Fakulteten för datavetenskaper [16801], Institutionen för programvaruteknik [16805]);Borg, Markus (RISE Research Institutes of Sweden AB, SWE);Cicchetti, Antonio (Mälardalen University, SWE);Ciccozzi, Federico (Mälardalen University, SWE);Olsson, Thomas (RISE Research Institutes of Sweden AB);Sentilles, Séverine (Mälardalen University, SWE);Svahnberg, Mikael [msv] (Blekinge Tekniska Högskola [16500], Fakulteten för datavetenskaper [16801], Institutionen för programvaruteknik [16805]);Wnuk, Krzysztof [krw] [0000-0003-3567-9300] (Blekinge Tekniska Högskola [16500], Fakulteten för datavetenskaper [16801], Institutionen för programvaruteknik [16805]);Gorschek, Tony [tgo] [0000-0002-3646-235x] (Blekinge Tekniska Högskola [16500], Fakulteten för datavetenskaper [16801], Institutionen för programvaruteknik [16805])",2021,Towards evidence-based decision-making for identification and usage of assets in composite software : A research roadmap,"<p>Software engineering is decision intensive. Evidence-based software engineering is suggested for decision-making concerning the use of methods and technologies when developing software. Software development often includes the reuse of software assets, for example, open-source components. Which components to use have implications on the quality of the software (e.g., maintainability). Thus, research is needed to support decision-making for composite software. This paper presents a roadmap for research required to support evidence-based decision-making for choosing and integrating assets in composite software systems. The roadmap is developed as an output from a 5-year project in the area, including researchers from three different organizations. The roadmap is developed in an iterative process and is based on (1) systematic literature reviews of the area; (2) investigations of the state of practice, including a case survey and a survey; and (3) development and evaluation of solutions for asset identification and selection. The research activities resulted in identifying 11 areas in need of research. The areas are grouped into two categories: areas enabling evidence-based decision-making and those related to supporting the decision-making. The roadmap outlines research needs in these 11 areas. The research challenges and research directions presented in this roadmap are key areas for further research to support evidence-based decision-making for composite software. © 2021 The Authors. Journal of Software: Evolution and Process published by John Wiley &amp; Sons Ltd.</p>",https://bth.diva-portal.org/smash/get/diva2:1540119/FULLTEXT01.pdf
Fischbach_79_2021,"Fischbach, Jannik (Qualicen GmbH, DEU);Frattini, Julian [juf] [0000-0003-3995-6125] (Blekinge Tekniska Högskola [16500], Fakulteten för datavetenskaper [16801], Institutionen för programvaruteknik [16805]);Vogelsang, Andreas (University of Cologne, DEU)",2021,CiRA : A Tool for the Automatic Detection of Causal Relationships in Requirements Artifacts,"<p>Requirements often specify the expected system behavior by using causal relations (e.g., If A, then B). Automatically extracting these relations supports, among others, two prominent RE use cases: Automatic test case derivation and dependency detection between requirements. However, existing tools fail to extract causality from natural language with reasonable performance. In this paper, we present our tool CiRA (Causality detection in Requirements Artifacts), which represents a first step towards automatic causality extraction from requirements. We evaluate CiRA on a publicly available data set of 61 acceptance criteria (causal: 32; non-causal: 29) describing the functionality of the German Corona-Warn-App. We achieve a macro1 score of 83 %, which corroborates the feasibility of our approach. © 2021 CEUR-WS. All rights reserved.</p>",https://bth.diva-portal.org/smash/get/diva2:1556389/FULLTEXT01.pdf
Garousi_113_2022,"Garousi, Vahid (University Belfast, GBR);Cutting, David (University Belfast, GBR);Felderer, Michael [mfd] [0000-0003-3818-4442] (Blekinge Tekniska Högskola [16500], Fakulteten för datavetenskaper [16801], Institutionen för programvaruteknik [16805])",2022,What users think of COVID-19 contact-tracing apps : An analysis of eight European apps,"<p>More than 64 countries and regions have, so far, developed COVID-19 contact-tracing apps to limit the spread of coronavirus. However, many experts and scientists cast doubt on the effectiveness of those apps. For each app, between a few hundred to a few thousand reviews have been entered by end-users in app stores. In this paper, we mine insights from the user reviews of contact-tracing apps of eight European countries to find out what end users think of COVID contact-tracing apps and the main problems that users have reported. IEEE</p>",
Guo_130_2021,"Guo, Hong (Anhui University, CHN);Li, Jingyue (Norwegian University of Science and Technology, NOR);Gao, Shang (Örebro University, SWE);Šmite, Darja [xds] [0000-0003-1744-3118] (Blekinge Tekniska Högskola [16500], Fakulteten för datavetenskaper [16801], Institutionen för programvaruteknik [16805])",2021,Understanding How Enterprise Architecture Contributes to Organizational Alignment,"<p>Alignment is one of the most important benefits that Enterprise Architecture (EA) could bring to organizations. However, it is still unclear what mechanism EA uses to help organizations achieve alignment. Related research is very scattered, making it difficult to accumulate relevant knowledge and experiences, and thus, the more successful EA application is hindered. To address this issue, the present research examines essential requirements of alignment and mechanisms with which underlying EA deliverable models impact organizations. By doing so, we proposed a conceptual framework explaining how EA modeling activities contribute to organizational alignment. We demonstrated the use of this framework with three use cases. The results show that EA could help organizations achieve alignment in quite different ways, and our proposed framework helped us examine and understand the mechanisms. We expect this research could establish an essential common understanding of how EA enables organizational alignment, thereby facilitating academia to move forward in this field. © 2021, IFIP International Federation for Information Processing.</p>",
Guo_131_2021,"Guo, Hong (Anhui University, CHN);Šmite, Darja [xds] [0000-0003-1744-3118] (Blekinge Tekniska Högskola [16500], Fakulteten för datavetenskaper [16801], Institutionen för programvaruteknik [16805]);Li, Jingyue (Norwegian University of Science and Technology, NOR);Gao, Shang (Örebro University, SWE)",2021,Enterprise Architecture and Agility : A Systematic Mapping Study,"<p>This article presents a systematic mapping study of published scientific papers on Enterprise Architecture (EA) and agility. More specifically, we reviewed studies on applying agile practices to EA and applying EA to the organization’s agility. A categorical structure is proposed for classifying the research results based on the extracted topics discussed. The categories include agile traits (i.e., principles and practices), EA practices, and organizational contexts. By mapping the published works and analyzing them, the article also highlights some trends and indicates some obstacles and needs for future research and practice. © 2021, Springer Nature Switzerland AG.</p>",
Gorschek_122_2021,"Gorschek, Tony [tgo] [0000-0002-3646-235x] (Blekinge Tekniska Högskola [16500], Fakulteten för datavetenskaper [16801], Institutionen för programvaruteknik [16805]);Mendez, Daniel [dmz] [0000-0003-0619-6027] (Blekinge Tekniska Högskola [16500], Fakulteten för datavetenskaper [16801], Institutionen för programvaruteknik [16805])",2021,Solving Problems or Enabling Problem-Solving? : from Purity in Empirical Software Engineering to Effective Co-production (Invited Keynote),"<p>Studying and collaborating with any software-intensive organization demands for excellence in empirical software engineering research. The ever-growing complexity and context-dependency of software products, however, demands for more pragmatic and solution-focused research. This is a great opportunity but it also conflicts with the traditional quest for “purity” in research and a very narrow focus of the work. In this short positioning, we elaborate on challenges which emerge from academia-industry collaborations and discuss touch upon pragmatic ways of approaching them along the co-production model which emerged from SERL Sweden. © 2021, Springer Nature Switzerland AG.</p>",
Henao_134_2021,"Henao, Pablo Restrepo (Technical University of Munich, DEU);Fischbach, Jannik (Qualicen GmbH, DEU);Spies, Dominik (Qualicen GmbH, DEU);Frattini, Julian [juf] [0000-0003-3995-6125] (Blekinge Tekniska Högskola [16500], Fakulteten för datavetenskaper [16801], Institutionen för programvaruteknik [16805]);Vogelsang, Anderas (University of Cologne, DEU)",2021,Transfer Learning for Mining Feature Requests and Bug Reports from Tweets and App Store Reviews,"<p>Identifying feature requests and bug reports in user comments holds great potential for development teams. However, automated mining of RE-related information from social media and app stores is challenging since (1) about 70% of user comments contain noisy, irrelevant information, (2) the amount of user comments grows daily making manual analysis unfeasible, and (3) user comments are written in different languages. Existing approaches build on traditional machine learning (ML) and deep learning (DL), but fail to detect feature requests and bug reports with high Recall and acceptable Precision which is necessary for this task. In this paper, we investigate the potential of transfer learning (TL) for the classification of user comments. Specifically, we train both monolingual and multilingual BERT models and compare the performance with state-of-the-art methods. We found that monolingual BERT models outperform existing baseline methods in the classification of English App Reviews as well as English and Italian Tweets. However, we also observed that the application of heavyweight TL models does not necessarily lead to better performance. In fact, our multilingual BERT models perform worse than traditional ML methods. © 2021 IEEE.</p>",
Wilson_342_2020,"Wilson, Magnus (Ericsson, SWE);Wnuk, Krzysztof [krw] [0000-0003-3567-9300] (Blekinge Tekniska Högskola [16500], Fakulteten för datavetenskaper [16801], Institutionen för programvaruteknik [16805]);Bengtsson, Lars (Lund Univ, LTH, SWE)",2020,Business Model Flexibility and Software-intensive Companies : Opportunities and Challenges,"<p>Background: Software plays an essential role in enabling digital transformation via digital services added to traditional products or fully digital business offerings. This calls for a better understanding of the relationships between the dynamic nature of business models and their realization using software engineering practices. Aim: In this paper, we synthesize the implications of digitalization on business model flexibility for software-intensive companies based on an extensive literature survey and a longitudinal case study at Ericsson AB. We analyze how software-intensive companies can better synchronize business model changes with software development processes and organizations. Method: We synthesize six propositions based on the literature review and extensive industrial experience with a large software-intensive company working in the telecommunication domain. Conclusions: Our work is designed to facilitate the cross-disciplinary analysis of business model dynamics and business model flexibility by linking value, transaction, and organizational learning to business model change. We believe that software engineering tools and methods can play a crucial role in enabling more automated synchronization between technology and business model changes.</p>",https://bth.diva-portal.org/smash/get/diva2:1614633/FULLTEXT01.pdf
Garousi_112_2022,"Garousi, Vahid (Queen's University Belfast, GBR);Cutting, David (Queen's University Belfast, GBR);Felderer, Michael [mfd] [0000-0003-3818-4442] (Blekinge Tekniska Högskola [16500], Fakulteten för datavetenskaper [16801], Institutionen för programvaruteknik [16805])",2022,Mining user reviews of COVID contact-tracing apps : An exploratory analysis of nine European apps,"<p>Context: More than 78 countries have developed COVID contact-tracing apps to limit the spread of coronavirus. However, many experts and scientists cast doubt on the effectiveness of those apps. For each app, a large number of reviews have been entered by end-users in app stores. Objective: Our goal is to gain insights into the user reviews of those apps, and to find out the main problems that users have reported. Our focus is to assess the “software in society” aspects of the apps, based on user reviews. Method: We selected nine European national apps for our analysis and used a commercial app-review analytics tool to extract and mine the user reviews. For all the apps combined, our dataset includes 39,425 user reviews. Results: Results show that users are generally dissatisfied with the nine apps under study, except the Scottish (“Protect Scotland”) app. Some of the major issues that users have complained about are high battery drainage and doubts on whether apps are really working. Conclusion: Our results show that more work is needed by the stakeholders behind the apps (e.g., app developers, decision-makers, public health experts) to improve the public adoption, software quality and public perception of these apps. © 2021 Elsevier Inc.</p>",https://bth.diva-portal.org/smash/get/diva2:1614677/FULLTEXT01.pdf
Schmid_270_2021,"Schmid, Roman (Bern, CHE);Fricker, Samuel [sfr] [0000-0001-7368-4448] (Blekinge Tekniska Högskola [16500], Fakulteten för datavetenskaper [16801], Institutionen för programvaruteknik [16805])",2021,Evaluation of a Stakeholder Satisfaction-oriented Method for Prioritising Change Requests,"<p>The prioritisation of change requests for an evolving software is an important and complex activity in the continuous requirements engineering and release planning of an evolving product. We have explored such prioritisation with an organisation consisting of several business units appearing as stakeholders that compete for the same development resources. The challenge lay in taking objective factors like the cost-benefit ratio and technical dependencies of the requests into account while creating a high level of stakeholder satisfaction with the defined release scope. Together with the organisation, we have designed and implemented a tailored method that uses the stakeholders' satisfaction as a structured means for validating the criteria-based prioritisation results. The paper extends prior work by taking the perspective of the organisational stakeholders and describing the method design from the organisation's perspective, reports the use of the method in the organisation, and summarises the lessons learned from using the method in the organisation. The results are useful to increase the maturity of prioritisation in industrialpractice. © 2021 IEEE.</p>",
Rodriguez_258_2022,"Rodriguez, Pilar (Univ Oulu, FIN);Urquhart, Cathy (Manchester Metropolitan Univ, GBR);Mendes, Emilia [eme] [0000-0003-0449-5322] (Blekinge Tekniska Högskola [16500], Fakulteten för datavetenskaper [16801], Institutionen för programvaruteknik [16805]) (Blekinge Tekniska Högskola [16500], Fakulteten för datavetenskaper [16801], Institutionen för datavetenskap [881506])",2022,A Theory of Value for Value-Based Feature Selection in Software Engineering,"<p>Value-Based Software Engineering stresses the role of value in software related decisions. In the context of feature selection, software features judged to provide higher value take priority in the development process. This paper focuses on what value means when selecting software features. Using grounded theory, we conducted and analyzed semi-structured interviews with 21 key stakeholders (decision-makers) from three software/software-intensive companies, within a context where value-based decision-making was already established. Our analysis led to the building of a theory of value for value-based feature selection that identifies the nature of value propositions considered by key stakeholders when selecting software features (i.e., decision-making criteria for deciding upon software features, as suggested by Boehm (2003)). We found that some value propositions were common to all three company cases (core value propositions), whereas others were dependent upon the context in which a company operates, and the characteristics of the product under development (specific value propositions). Moreover, value propositions vary according to the stakeholder group and the type of feature being assessed. Our study provides significant insight into value in the context of feature selection, and generates new concepts around value-based feature selection such as new value propositions.</p>",
