citationid,Name,Year,Title,Abstract,FullTextLink
Ouriques_228_2023,"Ouriques, Raquel [rou] [0000-0003-2679-0517] (Blekinge Tekniska Högskola [16500], Fakulteten för datavetenskaper [16801], Institutionen för programvaruteknik [16805]);Wnuk, Krzysztof [krw] [0000-0003-3567-9300] (Blekinge Tekniska Högskola [16500], Fakulteten för datavetenskaper [16801], Institutionen för programvaruteknik [16805]);Gorschek, Tony [tgo] [0000-0002-3646-235x] (Blekinge Tekniska Högskola [16500], Fakulteten för datavetenskaper [16801], Institutionen för programvaruteknik [16805]);Svensson, Richard Berntsson (University of Gothenburg)",2023,The role of knowledge-based resources in Agile Software Development contexts,"<p>The software value chain is knowledge-based since it is highly dependant on people. Consequently, a lack of practice in managing knowledge as a resource may jeopardise its application in software development. Knowledge-Based Resources (KBRs) relate to employees’ intangible knowledge that is deemed to be valuable to a company's competitive advantage. In this study, we apply a grounded theory approach to examine the role of KBRs in Agile Software Development (ASD). To this aim, we collected data from 18 practitioners from five companies. We develop the Knowledge-Push theory, which explains how KBRs boost the need for change in ASD. Our results show that the practitioners who participated in the study utilise, as primary strategies, task planning, resource management, and social collaboration. These strategies are implemented through the team environment and settings and incorporate an ability to codify and transmit knowledge. However, this process of codification is non-systematic, which consequently introduces inefficiency in the domain of knowledge resource utilisation, resulting in potential knowledge waste. This inefficiency can generate negative implications for software development, including meaningless searches in databases, frustration because of recurrent problems, the unnecessary redesign of solutions, and a lack of awareness of knowledge sources. © 2022 The Authors</p>",https://bth.diva-portal.org/smash/get/diva2:1722714/FULLTEXT01.pdf
Bjarnason_36_2023,"Bjarnason, Elizabeth (Lund University);Åberg, Patrik (Ericsson AB);Ali, Nauman bin [nal] [0000-0001-7266-5632] (Blekinge Tekniska Högskola [16500], Fakulteten för datavetenskaper [16801], Institutionen för programvaruteknik [16805])",2023,Software selection in large-scale software engineering : A model and criteria based on interactive rapid reviews,"<p>Context: Software selection in large-scale software development continues to be ad hoc and ill-structured. Previous proposals for software component selection tend to be technology-specific and/or do not consider business or ecosystem concerns. Objective: Our main aim is to develop an industrially relevant technology-agnostic method that can support practitioners in making informed decisions when selecting software components for use in tools or in products based on a holistic perspective of the overall environment. Method: We used method engineering to iteratively develop a software selection method for Ericsson AB based on a combination of published research and practitioner insights. We used interactive rapid reviews to systematically identify and analyse scientific literature and to support close cooperation and co-design with practitioners from Ericsson. The model has been validated through a focus group and by practical use at the case company. Results: The model consists of a high-level selection process and a wide range of criteria for assessing and for evaluating software to include in business products and tools. Conclusions: We have developed an industrially relevant model for component selection through active engagement from a company. Co-designing the model based on previous knowledge demonstrates a viable approach to industry-academia collaboration and provides a practical solution that can support practitioners in making informed decisions based on a holistic analysis of business, organisation and technical factors. © 2023, The Author(s).</p>",https://bth.diva-portal.org/smash/get/diva2:1744081/FULLTEXT01.pdf
Zabardast_362_2023,"Zabardast, Ehsan [ehz] [0000-0002-1729-5154] (Blekinge Tekniska Högskola [16500], Fakulteten för datavetenskaper [16801], Institutionen för programvaruteknik [16805]);Gonzalez-Huerta, Javier [jgh] [0000-0003-1350-7030] (Blekinge Tekniska Högskola [16500], Fakulteten för datavetenskaper [16801], Institutionen för programvaruteknik [16805]);Gorschek, Tony [tgo] [0000-0002-3646-235x] (Blekinge Tekniska Högskola [16500], Fakulteten för datavetenskaper [16801], Institutionen för programvaruteknik [16805]);Šmite, Darja [xds] [0000-0003-1744-3118] (Blekinge Tekniska Högskola [16500], Fakulteten för datavetenskaper [16801], Institutionen för programvaruteknik [16805]);Alégroth, Emil [EAL] [0000-0001-7526-3727] (Blekinge Tekniska Högskola [16500], Fakulteten för datavetenskaper [16801], Institutionen för programvaruteknik [16805]);Fagerholm, Fabian [faf] [0000-0002-7298-3021] (Blekinge Tekniska Högskola [16500], Fakulteten för datavetenskaper [16801], Institutionen för programvaruteknik [16805])",2023,A taxonomy of assets for the development of software-intensive products and services,"<p>Context:Developing software-intensive products or services usually involves a plethora of software artefacts. Assets are artefacts intended to be used more than once and have value for organisations; examples include test cases, code, requirements, and documentation. During the development process, assets might degrade, affecting the effectiveness and efficiency of the development process. Therefore, assets are an investment that requires continuous management.</p><p>Identifying assets is the first step for their effective management. However, there is a lack of awareness of what assets and types of assets are common in software-developing organisations. Most types of assets are understudied, and their state of quality and how they degrade over time have not been well-understood.</p><p>Methods:We performed an analysis of secondary literature and a field study at five companies to investigate and identify assets to fill the gap in research. The results were analysed qualitatively and summarised in a taxonomy.</p><p>Results:We present the first comprehensive, structured, yet extendable taxonomy of assets, containing 57 types of assets.</p><p>Conclusions:The taxonomy serves as a foundation for identifying assets that are relevant for an organisation and enables the study of asset management and asset degradation concepts.</p>",https://bth.diva-portal.org/smash/get/diva2:1749684/FULLTEXT01.pdf
Klotins_163_2023,"Klotins, Eriks [ekx] [0000-0002-1987-2234] (Blekinge Tekniska Högskola [16500], Fakulteten för datavetenskaper [16801], Institutionen för programvaruteknik [16805]);Gorschek, Tony [tgo] [0000-0002-3646-235x] (Blekinge Tekniska Högskola [16500], Fakulteten för datavetenskaper [16801], Institutionen för programvaruteknik [16805]);Wilson, Magnus (Ericsson AB, Sweden)",2023,Continuous Software Engineering : Introducing an Industry Readiness Model,"<p>Software is becoming essential for most products, manufacturing processes, and back-office functions. The speed of delivering new features and refining the product is critical to remaining competitive. Software organizations may adopt continuous engineering practices to become more efficient. However, retrofitting an organization with a pipeline is challenging. Importantly, the most significant challenges and opportunities, are related to, but stem from outside the engineering realm and require rethinking customer relationships and business models. This paper presents a hierarchy of continuous engineering benefits and challenges. It is aimed to guide the adoption of continuous practices in an organization to determine the current and target level of adoption, given organizational context, ambitions, and domain constraints. IEEE</p>",
Klotins_165_2023,"Klotins, Eriks [ekx] [0000-0002-1987-2234] (Blekinge Tekniska Högskola [16500], Fakulteten för datavetenskaper [16801], Institutionen för programvaruteknik [16805]);Talbert-Goldstein, Elliot (University of Maryland, United States)",2023,Organizational Conflicts in the Adoption of Continuous Software Engineering,"<p>Software is a critical component of nearly every product or service. Improvements in software can lead to substantial competitive advantages. At the same time, software and surrounding engineering teams have become increasingly complex. The adoption of continuous integration and delivery is a recent trend to radically improve software release speed. However, its adoption is far from straightforward. Specifically, rethinking processes, organizational culture, ways of working, and business models require buy-in from diverse stakeholders that may have conflicting objectives. Such situations are explored by organizational conflict research. This paper reports on early lessons from an ongoing research project in continuous software engineering, specifically investigating adoption challenges from an organizational conflict perspective. We identify catalysts, symptoms, and outcomes of organizational conflicts hindering the adoption process. We conclude that predictable conflicts emerge when adopting continuous engineering. Engineers, managers, and other teams can proactively prepare for and allocate resources to resolve them. Proper analysis and management can help avoid wasted time, impeding processes, and frustration. © 2023, The Author(s).</p>",https://bth.diva-portal.org/smash/get/diva2:1774955/FULLTEXT01.pdf
Šmite_374_2023,"Šmite, Darja [xds] [0000-0003-1744-3118] (Blekinge Tekniska Högskola [16500], Fakulteten för datavetenskaper [16801], Institutionen för programvaruteknik [16805]);Moe, Nils Brede [nbm] [0000-0003-2669-0778] (Blekinge Tekniska Högskola [16500], Fakulteten för datavetenskaper [16801], Institutionen för programvaruteknik [16805])",2023,The Role of Responsiveness to Change in Large Onboarding Campaigns,"<p>Onboarding is a process of organizational socialization of the new hires, that includes recruitment, orientation, training, coaching and support. While onboarding individuals into an organization is a rather straightforward task, little is known about 1) onboarding hundreds of developers and 2) doing it on a distance in outsourcing situations. Furthermore, the subject of sustainable growth with respect to organizational capabilities and culture is often overlooked. This paper reports findings from an exploratory multi-case study of two large onboarding campaigns. We collected empirical data from interviews, retrospectives, onboarding documentation and onsite visits. Based on the empirical study, onboarding hundreds of software engineers in a complex agile product development environment which lacks documentation and puts high demands on engineers’ knowledge and skills is a challenging and costly endeavor. To save the costs and for practical reasons, large-scale onboarding is organized in batches with the first batch trained onsite, and the later batches trained internally. We report challenges faced in the two cases and discuss possible solutions. One core finding is that a good plan combined with the organizational agility, i.e., the responsiveness to change, together with organizational maturity determined the success of organizational scaling. The presented cases contribute to the scarce research on knowledge transfer and onboarding in a large-scale agile context. © 2023, The Author(s).</p>",https://bth.diva-portal.org/smash/get/diva2:1774995/FULLTEXT01.pdf
Chen_50_2023,"Chen, Xingru [xcn] [0000-0003-1181-9049] (Blekinge Tekniska Högskola [16500], Fakulteten för datavetenskaper [16801], Institutionen för programvaruteknik [16805]);Usman, Muhammad [muu] [0000-0002-8132-0107] (Blekinge Tekniska Högskola [16500], Fakulteten för datavetenskaper [16801], Institutionen för programvaruteknik [16805]);Badampudi, Deepika [deb] [0000-0002-6215-1774] (Blekinge Tekniska Högskola [16500], Fakulteten för datavetenskaper [16801], Institutionen för programvaruteknik [16805])",2023,Using InnerSource for Improving Internal Reuse : An Industrial Case Study,"<p>Background: InnerSource consists of the use of open source development techniques within the corporation. It helps improve software reuse through increased transparency and inter-team collaboration. Companies need to understand their context and specific needs before deciding to adopt any specific InnerSource practices since they cannot apply all InnerSource practices at once. Aim: This study aims to support the case company in assessing its readiness for adopting InnerSource practices to improve its internal reuse, identify and prioritize the improvement areas, and identify suitable solutions. Method: We performed a case study using a questionnaire and a workshop to check the current and desired status of adopting InnerSource practices and collect potential solutions. Results: The study participants identified that the company needs to prioritize the improvements related to the discoverability, communication channels, and ownership of the reusable assets. In addition, they identified certain InnerSource practices as solutions for the prioritized improvement areas, such as better structured repositories for storing and searching the reusable assets and standardized documentation of the reusable assets. Conclusion: The questionnaire instrument aids the case company in identifying the improvement areas related to InnerSource and reuse practices. InnerSource practices could improve the development and maintenance of reusable assets. Keywords: InnerSource, software reuse, readiness © 2023 Owner/Author.</p>",https://bth.diva-portal.org/smash/get/diva2:1777791/FULLTEXT01.pdf
Salleh_265_2023,"Salleh, Norsaremah (International Islamic University, Malaysia);Mendes, Emilia [eme] [0000-0003-0449-5322] (Blekinge Tekniska Högskola [16500], Fakulteten för datavetenskaper [16801], Institutionen för datavetenskap [881506]);Mendes, Fabiana (University of Brasilia, Brazil);Dissanayake Lekamlage, Charitha (Blekinge Tekniska Högskola [16500]) (student);Petersen, Kai [kps] [0000-0002-1532-8223] (Blekinge Tekniska Högskola [16500], Fakulteten för datavetenskaper [16801], Institutionen för programvaruteknik [16805])",2023,Value-based Software Engineering : A Systematic Mapping Study,"<p>Background: Integrating value-oriented perspectives into the principles and practices of software engineering is fundamental to ensure that software development activities address key stakeholders’ views and also balance short-and long-term goals. This is put forward in the discipline of value-based software engineering (VBSE) Aim: This study aims to provide an overview of VBSE with respect to the research efforts that have been put into VBSE. Method: We conducted a systematic mapping study to classify evidence on value definitions, studies’ quality, VBSE principles and practices, research topics, methods, types, contribution facets, and publication venues. Results: From 143 studies we found that the term “value” has not been clearly defined in many studies. VB Requirements Engineering and VB Planning and Control were the two principles mostly investigated, whereas VB Risk Management and VB People Management were the least researched. Most studies showed very good reporting and relevance quality, acceptable credibility, but poor in rigour. Main research topic was Software Requirements and case study research was the method used the most. The majority of studies contribute towards methods and processes, while very few studies have proposed metrics and tools. Conclusion: We highlighted the research gaps and implications for research and practice to support VBSE. © 2023 The Authors.</p>",https://bth.diva-portal.org/smash/get/diva2:1785864/FULLTEXT01.pdf
Sjöberg_286_2023,"Sjöberg, Peter [pes] (Blekinge Tekniska Högskola [16500], Fakulteten för datavetenskaper [16801], Institutionen för programvaruteknik [16805]) (Volvo Construction Equipment, Västerås, Sweden);Mendez, Daniel [dmz] [0000-0003-0619-6027] (Blekinge Tekniska Högskola [16500], Fakulteten för datavetenskaper [16801], Institutionen för programvaruteknik [16805]);Gorschek, Tony [tgo] [0000-0002-3646-235x] (Blekinge Tekniska Högskola [16500], Fakulteten för datavetenskaper [16801], Institutionen för programvaruteknik [16805])",2023,Contemporary Challenges when Developing Cyber-Physical Systems of Systems - A Case Study,"<p>Digitalization has created service business opportunities for machine manufacturing companies. But creating these cyber-physical systems of systems effectively constitutes a critical measure of success in practice. At the same time, the body of knowledge in software engineering provides little guidance on how to manage this evolution. To contribute to closing this gap in the long run via problem-driven research, we need to first understand which contemporary challenges and needs are encountered in industry. To this end, we conducted a series of semi-structured interviews at a machine manufacturing company, that is expanding its service offerings utilizing digitalization, where we explored how such systems are engineered and what challenges and needs are encountered. © 2023 IEEE.</p>",https://bth.diva-portal.org/smash/get/diva2:1795425/FULLTEXT02.pdf
Simaremare_282_2024,"Simaremare, Mario [mcb] [0000-0002-7873-6363] (Blekinge Tekniska Högskola [16500], Fakulteten för datavetenskaper [16801], Institutionen för programvaruteknik [16805]);Edison, Henry [hed] [0000-0002-9494-8059] (Blekinge Tekniska Högskola [16500], Fakulteten för datavetenskaper [16801], Institutionen för programvaruteknik [16805])",2024,AI Assistant to Improve Experimentation in Software Startups Using Large Language Model and Prompt Engineering,"<p>Software startup is a unique type of company with unique characteristics. On the one hand, they must offer innovative products appealing to customers to generate revenue and survive, but on the other hand, they are limited in resources, time, and experience. During the new product development, it is important to experiment with their original ideas. However, doing a meaningful experiment requires resources and challenges. A study on failed software startups shows that, despite its importance, many software startups skipped or did not experiment with their ideas. The study identifies 25 inhibitors spread in five experimentation stages. In the last few years, Large Language Models (LLMs) have become a popular technology. The advancement of LLM has made it adopted into many parts of the software development cycle. Studies show that LLM also has been used to generate new innovative product ideas and to manage innovation. However, there is no investigation into the possibility of utilizing the power of LLM to help software startups do experimentation. Interactions to an LLM are done through prompts. During the interaction or session, a user will send one or more prompts in a zero-, one-, or few-shots to an LLM agent. Unfortunately, learning and using prompts effectively requires time and resources, things that software startups are scarce with. In this project, we aim to help improve the experimentation process and address the inhibitors by leveraging the power of LLMs. There are five initial research questions and studies planned in the project. In the first step, we will investigate current experimentation practices, challenges, inhibitors, and the strategies used to circumvent them. Secondly, we will investigate how AI has been used in today's experimentation. Then, we will investigate the set of measurements available to measure the success of an experiment. The next step is to investigate how to support experimentation using LLMs followed by a validation sequence. The first form of support is a prompt guidebook to help software startups use an LLM agent to help their experimentation. The second form is an LLM-based assistant tailored specifically to guide the experimentation process. © 2006 Gesellschaft für Informatik, Bonn.</p>",https://bth.diva-portal.org/smash/get/diva2:1838491/FULLTEXT01.pdf
Fischbach_75_2023,"Fischbach, Jannik (Netlight Consulting GmbH, Germany);Adam, Max (Technical University of Munich, Germany);Dzhagatspanyan, Victor (Technical University of Munich, Germany);Mendez, Daniel [dmz] [0000-0003-0619-6027] (Blekinge Tekniska Högskola [16500], Fakulteten för datavetenskaper [16801], Institutionen för programvaruteknik [16805]);Frattini, Julian [juf] [0000-0003-3995-6125] (Blekinge Tekniska Högskola [16500], Fakulteten för datavetenskaper [16801], Institutionen för programvaruteknik [16805]);Kosenkov, Oleksandr (Fortiss GmbH, Germany);Elahidoost, Parisa (Fortiss GmbH, Germany)",2023,Automatic ESG Assessment of Companies by Mining and Evaluating Media Coverage Data : NLP Approach and Tool,"<p>[Context:] Society increasingly values sustainable corporate behaviour, impacting corporate reputation and customer trust. Hence, companies regularly publish sustainability reports to shed light on their impact on environmental, social, and governance (ESG) factors. [Problem:] Sustainability reports are written by companies and therefore considered a company-controlled source. Contrarily, studies reveal that non-corporate channels (e.g., media coverage) represent the main driver for ESG transparency. However, analysing media coverage regarding ESG factors is challenging since (1) the amount of published news articles grows daily, (2) media coverage data does not necessarily deal with an ESG-relevant topic, meaning that it must be carefully filtered, and (3) the majority of media coverage data is unstructured. [Research Goal:] We aim to automatically extract ESG-relevant information from textual media reactions to calculate an ESG score for a given company. Our goal is to reduce the cost of ESG data collection and make ESG information available to the general public. [Contribution:] Our contributions are three-fold: First, we publish a corpus of 432,411 news headlines annotated as being environmental-, governance-, social-related, or ESG-irrelevant. Second, we present our tool-supported approach called ESG-Miner, capable of automatically analysing and evaluating corporate ESG performance headlines. Third, we demonstrate the feasibility of our approach in an experiment and apply the ESG-Miner on 3000 manually labelled headlines. Our approach correctly processes 96.7% of the headlines and shows great performance in detecting environmental-related headlines and their correct sentiment. © 2023 IEEE.</p>",
Papatheocharous_231_2024,"Papatheocharous, Efi [epa] [0000-0002-5157-8131] (Blekinge Tekniska Högskola [16500], Fakulteten för datavetenskaper [16801], Institutionen för programvaruteknik [16805]);Wohlin, Claes [cwo] [0000-0003-0460-5253] (Blekinge Tekniska Högskola [16500], Fakulteten för datavetenskaper [16801], Institutionen för programvaruteknik [16805]);Badampudi, Deepika [deb] [0000-0002-6215-1774] (Blekinge Tekniska Högskola [16500], Fakulteten för datavetenskaper [16801], Institutionen för programvaruteknik [16805]);Carlson, Jan (Malardalen University);Wnuk, Krzysztof [krw] [0000-0003-3567-9300] (Blekinge Tekniska Högskola [16500], Fakulteten för datavetenskaper [16801], Institutionen för programvaruteknik [16805])",2024,Context factors perceived important when looking for similar experiences in decision-making for software components : An interview study,"<p>During software evolution, decisions related to components' origin or source significantly impact the quality properties of the product and development metrics such as cost, time to market, ease of maintenance, and further evolution. Thus, such decisions should ideally be supported by evidence, i.e., using previous experiences and information from different sources, even own previous experiences. A hindering factor to such reuse of previous experiences is that these decisions are highly context-dependent and it is difficult to identify when previous experiences come from sufficiently similar contexts to be useful in a current setting. Conversely, when documenting a decision (as a decision experience), it is difficult to know which context factors will be most beneficial when reusing the experience in the future. An interview study is performed to identify a list of context factors that are perceived to be most important by practitioners when using experiences to support decision-making for component sourcing, using a specific scenario with alternative sources of experiences. We observed that the further away (from a company or an interviewee) the experience evidence is, as is the case for online experiences, the more context factors are perceived as important by practitioners to make use of the experience. Furthermore, we discuss and identify further research to make this type of decision-making more evidence-based. With this interview study, which focuses on which context factors are perceived as important by practitioners when reusing previous knowledge on software component reuse, we contribute with a listing of factors perceived to be important when reusing experiences from other prior decision-making cases of selecting among software components options. image</p>",https://bth.diva-portal.org/smash/get/diva2:1854384/FULLTEXT01.pdf
