citationid,Name,Year,Title,Abstract,FullTextLink
Jasarevic_151_2021,"Jasarevic, Mirza [mjc] (Blekinge Tekniska Högskola [16500], Fakulteten för datavetenskaper [16801], Institutionen för programvaruteknik [16805]);Boeva, Veselka [vbx] [0000-0003-3128-191x] (Blekinge Tekniska Högskola [16500], Fakulteten för datavetenskaper [16801], Institutionen för datavetenskap [881506]);Sjölin, Fredrik (Municipality of Karlskrona, SWE);Gramstad, Per-Olav (Municipality of Karlskrona, SWE)",2021,Understanding Traffic Cruising Causation Via Parking Data Enhancement,"<p>This study is devoted to understanding traffic cruising causation through exploring and enhancing parking data. Five recent (2017-2020) studies modeling parking congestion relied on occupancy as their only parking lot feature, then compared modeling techniques using this feature, to find the best performance. However, recently some computer scientists pointed out that it is more effective for the computer science community to focus more on data preparation for performance improvements, rather than exclusively comparing modeling techniques. This inspired us to add more parking lot features and evaluate them, to investigate how they should be composed into a congestion score, acting as a more accurate picture of reality. The score is then compared to the performance of a version where occupancy is the only parking lot feature. An experimental case study is designed in three parts. The first measures how the features should be summed into a score according to drivers' expectations. The second analyzes how much data can be reused from the real data, and whether spatial or temporal comparisons are better for data synthesis of parking data. The third part compares the performance of the score against the occupancy-only version using k-means clustering algorithm and dynamic time warping distance. The experimental results show performance improvements in all spatial and temporal categories, and increasing improvement as the sample sizes grow. © 2021 IEEE.</p>",https://bth.diva-portal.org/smash/get/diva2:1645931/FULLTEXT01.pdf
Huber_138_2022,"Huber, Stefan (University of Applied Sciences FH Kufstein Tirol, AUT);Demetz, Lukas (University of Applied Sciences FH Kufstein Tirol, AUT);Felderer, Michael [mfd] [0000-0003-3818-4442] (Blekinge Tekniska Högskola [16500], Fakulteten för datavetenskaper [16801], Institutionen för programvaruteknik [16805])",2022,A comparative study on the energy consumption of Progressive Web Apps,"<p>Progressive Web Apps (PWAs) are a promising approach for developing mobile apps, especially when developing apps for multiple mobile systems. As mobile devices are limited with respect to battery capacity, developers should keep the energy footprint of a mobile app as low as possible. The goal of this study is to analyze the difference in energy consumption of PWAs compared to other mobile development approaches. As mobile apps are primarily interactive in nature, we focus on UI rendering and interaction scenarios. For this, we implemented five versions of the same app with different development approaches and examined their energy footprint on two Android devices with four execution scenarios. Additionally, we extended our research by analyzing multiple real-world mobile apps to include a more practical perspective. Regarding execution environments, we also compared the energy consumption of PWAs executed in different web-browsers. The results based on sample and real-world apps show that the used development approach influences the energy footprint of a mobile app. Native development shows the lowest energy consumption. PWAs, albeit having a higher energy consumption than native apps, are a viable alternative to other mobile cross-platform development (MCPD) approaches. The experiments could not assert an inherent technological disadvantage of PWAs in contrast to other MCPD approaches when considering UI energy consumption. Moreover, the web-browser engine used to execute the PWA has a significant influence on the energy footprint of the app. © 2022 Elsevier Ltd</p>",
Polepalle_249_2022,"Polepalle, Chahna (Blekinge Tekniska Högskola [16500]) (Student);Kondoju, Ravi Shankar (AFRY, SWE);Badampudi, Deepika [deb] [0000-0002-6215-1774] (Blekinge Tekniska Högskola [16500], Fakulteten för datavetenskaper [16801], Institutionen för programvaruteknik [16805])",2022,Evidence and perceptions on GUI test automation - An exploratory study,"<p>Context: Software testing requires substantial effort in maintaining GUI test scripts, leading to rework or waste. Therefore, it is important to identify the factors leading to waste in GUI-based automation testing. Objective: To identify testability requirements and factors associated with waste from literature and practice. Methods: We conducted a literature review to identify the state of knowledge and a two-phased interview with practitioners to capture their subjective opinions and gather their views on the state of knowledge. Results: We identified 16 testability requirements and 14 factors associated with waste in GUI test automation. We classified each of them into SUT-related, test-process-related, test-tool-related, human and organizational, environment and cross-cutting. Conclusions: Our results indicate that the generic testability requirements identified in the literature are also valid for GUI automation testing. Our study identifies new findings in addition to the existing literature. Â© 2022 Owner/Author.</p>",https://bth.diva-portal.org/smash/get/diva2:1651610/FULLTEXT01.pdf
Guo_128_2021,"Guo, Hong (Anhui Univ, CHN);Li, Jingyue (Norwegian Univ Sci & Technol, NOR);Gao, Shang (Orebro Univ, SWE);Šmite, Darja [xds] [0000-0003-1744-3118] (Blekinge Tekniska Högskola [16500], Fakulteten för datavetenskaper [16801], Institutionen för programvaruteknik [16805])",2021,Agile Enterprise Architecture by Leveraging Use Cases,"<p>Despite benefits Enterprise Architecture (EA) has brought, EA has also been challenged due to its complexity, heavy workload demands, and poor user acceptance. Researchers and practitioners proposed to use EA in an agile and ""business outcome-driven"" way. This means that EA should not primarily be developed and used according to a pre-defined framework. Instead, EA should be developed and used for specific business purposes and by means of concrete deliverables. By doing so, a more effective and efficient way of EA application could be enabled. However, there is no common agreement on what types of business goals can be expected to be achieved by using EA (The What) and how to achieve these goals through EA solutions (The How). To address these issues, we analysed the information provided by leading EA tool vendors available on their websites to get inspiration. The results showed that Use Cases (UCs) are used generally to motivate potential EA users by focusing on specific business issues. Then, EA solutions to address such business requirements or challenges are scoped and derived accordingly. We expect relevant findings could bring inspiration to agile EA engineering, change the EA heavy-weight"" reputation, and improve the application of EA even among its sceptics.</p>",
Klotins_161_2022,"Klotins, Eriks [ekx] [0000-0002-1987-2234] (Blekinge Tekniska Högskola [16500], Fakulteten för datavetenskaper [16801], Institutionen för programvaruteknik [16805]);Gorschek, Tony [tgo] [0000-0002-3646-235x] (Blekinge Tekniska Högskola [16500], Fakulteten för datavetenskaper [16801], Institutionen för programvaruteknik [16805])",2022,Continuous Software Engineering in the Wild,"<p>Software is becoming a critical component of most products and organizational functions. The ability to continuously improve software determines how well the organization can respond to market opportunities. Continuous software engineering promises numerous advantages over sprint-based or plan-driven development. However, implementing a continuous software engineering pipeline in an existing organization is challenging. In this invited position paper, we discuss the adoption challenges and argue for a more systematic methodology to drive the adoption of continuous engineering. Our discussion is based on ongoing work with several industrial partners as well as experience reported in both state-of-practice and state-of-the-art. We conclude that the adoption of continuous software engineering primarily requires analysis of the organization, its goals, and constraints. One size does not fit all purposes, meaning that many of the principles behind continuous engineering are relevant for most organizations, but the level of realization and the benefits may still vary. The main hindrances to continuous flow of software arise from sub-optimal organizational structures and the lack of alignment. Once those are removed, the organization can implement automation to further improve the software delivery. © 2022, Springer Nature Switzerland AG.</p>",
Guo_129_2021,"Guo, Hong (Anhui Univ, CHN);Li, Jingyue (Norwegian Univ Sci & Technol, NOR);Gao, Shang (Orebro Univ, SWE);Šmite, Darja [xds] [0000-0003-1744-3118] (Blekinge Tekniska Högskola [16500], Fakulteten för datavetenskaper [16801], Institutionen för programvaruteknik [16805])",2021,Boost the Potential of EA : Essential Practices,"<p>Enterprise Architecture (EA) has been applied widely in industry as it brings important benefits to ease communication and improve business-IT alignment. However, various challenges were also reported due to the difficulty and complexity of applying it. Some empirical studies showed that EA stilled played a limited role in many organizations. In this research, we showed other findings where the potential of EA could be better used. They are derived from our analysis of advanced EA tool recommendations. Based on these findings, we proposed four essential EA practices and the rationales behind them in order to improve the understanding of current practices and bring insights for future studies to boost the potential of EA.</p>",
Klotins_162_2022,"Klotins, Eriks [ekx] [0000-0002-1987-2234] (Blekinge Tekniska Högskola [16500], Fakulteten för datavetenskaper [16801], Institutionen för programvaruteknik [16805]);Gorschek, Tony [tgo] [0000-0002-3646-235x] (Blekinge Tekniska Högskola [16500], Fakulteten för datavetenskaper [16801], Institutionen för programvaruteknik [16805]);Sundelin, Katarina (Ericsson AB Karlskrona, SWE);Falk, Erik (Telia Co Uppsala, SWE)",2022,Towards cost-benefit evaluation for continuous software engineering activities,"<p>Context: Software companies must become better at delivering software to remain relevant in the market. Continuous integration and delivery practices promise to streamline software deliveries to end-users by implementing an automated software development and delivery pipeline. However, implementing or retrofitting an organization with such a pipeline is a substantial investment, while the reporting on benefits and their relevance in specific contexts/domains are vague. Aim: In this study, we explore continuous software engineering practices from an investment-benefit perspective. We identify what benefits can be attained by adopting continuous practices, what the associated investments and risks are, and analyze what parameters determine their relevance. Method: We perform a multiple case study to understand state-of-practice, organizational aims, and challenges in adopting continuous software engineering practices. We compare state-of-practice with state-of-the-art to validate the best practices and identify relevant gaps for further investigation. Results: We found that companies start the CI/CD adoption by automating and streamlining the internal development process with clear and immediate benefits. However, upgrading customers to continuous deliveries is a major obstacle due to existing agreements and customer push-back. Renegotiating existing agreements comes with a risk of losing customers and disrupting the whole organization. Conclusions: We conclude that the benefits of CI/CD are overstated in literature without considering the contextual and domain complexities rendering some benefits infeasible. We identify the need to understand the customer and organizational perspectives further and understand the contextual requirements towards the CI/CD.</p>",https://bth.diva-portal.org/smash/get/diva2:1691652/FULLTEXT01.pdf
Zabardast_361_2022,"Zabardast, Ehsan [ehz] [0000-0002-1729-5154] (Blekinge Tekniska Högskola [16500], Fakulteten för datavetenskaper [16801], Institutionen för programvaruteknik [16805]);Frattini, Julian [juf] [0000-0003-3995-6125] (Blekinge Tekniska Högskola [16500], Fakulteten för datavetenskaper [16801], Institutionen för programvaruteknik [16805]);Gonzalez-Huerta, Javier [jgh] [0000-0003-1350-7030] (Blekinge Tekniska Högskola [16500], Fakulteten för datavetenskaper [16801], Institutionen för programvaruteknik [16805]);Mendez, Daniel [dmz] [0000-0003-0619-6027] (Blekinge Tekniska Högskola [16500], Fakulteten för datavetenskaper [16801], Institutionen för programvaruteknik [16805]);Gorschek, Tony [tgo] [0000-0002-3646-235x] (Blekinge Tekniska Högskola [16500], Fakulteten för datavetenskaper [16801], Institutionen för programvaruteknik [16805]);Wnuk, Krzysztof [krw] [0000-0003-3567-9300] (Blekinge Tekniska Högskola [16500], Fakulteten för datavetenskaper [16801], Institutionen för programvaruteknik [16805])",2022,Assets in Software Engineering : What are they after all?,"<p>During the development and maintenance of software-intensive products or services, we depend on various artefacts. Some of those artefacts, we deem central to the feasibility of a project and the product's final quality. Typically, these central artefacts are referred to as assets. However, despite their central role in the software development process, little thought is yet invested into what eventually characterises as an asset, often resulting in many terms and underlying concepts being mixed and used inconsistently. A precise terminology of assets and related concepts, such as asset degradation, are crucial for setting up a new generation of cost-effective software engineering practices. In this position paper, we critically reflect upon the notion of assets in software engineering. As a starting point, we define the terminology and concepts of assets and extend the reasoning behind them. We explore assets’ characteristics and discuss what asset degradation is as well as its various types and the implications that asset degradation might bring for the planning, realisation, and evolution of software-intensive products and services over time. We aspire to contribute to a more standardised definition of assets in software engineering and foster research endeavours and their practical dissemination in a common, more unified direction. © 2022 The Authors</p>",https://bth.diva-portal.org/smash/get/diva2:1694904/FULLTEXT01.pdf
Chen_48_2022,"Chen, Xingru [xcn] [0000-0003-1181-9049] (Blekinge Tekniska Högskola [16500], Fakulteten för datavetenskaper [16801], Institutionen för programvaruteknik [16805]);Badampudi, Deepika [deb] [0000-0002-6215-1774] (Blekinge Tekniska Högskola [16500], Fakulteten för datavetenskaper [16801], Institutionen för programvaruteknik [16805]);Usman, Muhammad [muu] [0000-0002-8132-0107] (Blekinge Tekniska Högskola [16500], Fakulteten för datavetenskaper [16801], Institutionen för programvaruteknik [16805])",2022,Reuse in Contemporary Software Engineering Practices - An Exploratory Case Study in A Medium-sized Company,"<p>Background: Software practice is evolving with changing technologies and practices such as InnerSource, DevOps, and microservices. It is important to investigate the impact of contemporary software engineering (SE) practices on software reuse.Aim: This study aims to characterize software reuse in contemporary SE practices and investigate its implications in terms of costs, benefits, challenges, and potential improvements in a medium-sized company.Method: We performed an exploratory case study by conducting interviews, group discussions, and reviewing company documentation to investigate software reuse in the context of contemporary SE practices in the case company.Results: The results indicate that the development for reuse in contemporary SE practices incurs additional coordination, among other costs. Development with reuse led to relatively fewer additional costs and resulted in several benefits such as better product quality and less development and delivery time. Ownership of reusable assets is challenging in contemporary SE practice. InnerSource practices may help mitigate the top perceived challenges: discoverability and ownership of the reusable assets, knowledge sharing and reuse measurement.Conclusion: Reuse in contemporary SE practices is not without additional costs and challenges. However, the practitioners perceive costs as investments that benefit the company in the long run.</p>",https://bth.diva-portal.org/smash/get/diva2:1696267/FULLTEXT01.pdf
Klotins_164_2022,"Klotins, Eriks [ekx] [0000-0002-1987-2234] (Blekinge Tekniska Högskola [16500], Fakulteten för datavetenskaper [16801], Institutionen för programvaruteknik [16805]);Peretz-Andersson, Einav (Jonkoping University, SWE)",2022,The unified perspective of digital transformation and continuous software engineering,"<p>Software is a key component of most products, services, industrial processes, and back-office functions. Thus, companies may gain an advantage by establishing fast feedback cycles to improve their software. Continuous software engineering (CI/CD) is being primarily studied as an engineering topic. However, the rest of the organization needs to align and be prepared to utilize the benefits of CI/CD. In this paper, we explore the overlap between CI/CD and digital transformation (DT). We study literature in both areas to develop a map of conditions, mechanisms, and outcomes. As a result, we present a unified perspective of CI/CD and DT. We found that CI/CD can be seen as an implementation of DT in a software organization. DT perspective can help to guide the adoption of CI/CD from an organizational perspective.</p>",
Šmite_379_2023,"Šmite, Darja [xds] [0000-0003-1744-3118] (Blekinge Tekniska Högskola [16500], Fakulteten för datavetenskaper [16801], Institutionen för programvaruteknik [16805]);Moe, Nils Brede [nbm] [0000-0003-2669-0778] (Blekinge Tekniska Högskola [16500], Fakulteten för datavetenskaper [16801], Institutionen för programvaruteknik [16805]);Klotins, Eriks [ekx] [0000-0002-1987-2234] (Blekinge Tekniska Högskola [16500], Fakulteten för datavetenskaper [16801], Institutionen för programvaruteknik [16805]);Gonzalez-Huerta, Javier [jgh] [0000-0003-1350-7030] (Blekinge Tekniska Högskola [16500], Fakulteten för datavetenskaper [16801], Institutionen för programvaruteknik [16805])",2023,From forced Working-From-Home to voluntary working-from-anywhere : Two revolutions in telework,"<p>The COVID-19 outbreak has admittedly caused interruptions to production, transportation, and mobility, therefore, having a significant impact on the global supply and demand chain's well-functioning. But what happened to companies developing digital services, such as software? How has the enforced Working-From-Home (WFH) mode impacted their ability to deliver software, if at all? This article shares our findings from monitoring the WFH during 2020 in an international software company with engineers located in Sweden, the USA, and the UK. We analyzed different aspects of productivity, such as developer job satisfaction and well-being, activity, communication and collaboration, efficiency and flow based on the archives of commit data, calendar invites, Slack communication, the internal reports of WFH experiences, and 30 interviews carried out in April/May and September 2020. We add more objective evidence to the existing COVID-19 studies the vast majority of which are based on self-reported productivity from the early months of the pandemic. We find that engineers continue committing code and carrying out their daily duties, as their routines adjust to “the new norm”. Our key message is that software engineers can work from home and quickly adjust their tactical approaches to the changes of unprecedented scale. Further, WFH has its benefits, including better work-life balance, improved flow, and improved quality of distributed meetings and events. Yet, WFH is not challenge free: not everybody feels equally productive working from home, work hours for many increased, while physical activity, socialization, pairing and opportunities to connect to unfamiliar colleagues decreased. Information sharing and meeting patterns also changed. Finally, experiences gained during the pandemic will have a lasting impact on the future of the workplace. The results of an internal company-wide survey suggest that only 9% of engineers will return to work in the office full time. Our article concludes with the InterSoft's strategy for work from anywhere (WFX), and a list of useful adjustments for a better WFH. © 2022 The Author(s)</p>",https://bth.diva-portal.org/smash/get/diva2:1705188/FULLTEXT01.pdf
Guo_127_2022,"Guo, Hong (Anhui University, CHN);Li, Jingyue (Norwegian University of Science & Technology, NOR);Gao, Shang [0000-0002-3722-6797] (Örebro University);Šmite, Darja [xds] [0000-0003-1744-3118] (Blekinge Tekniska Högskola [16500], Fakulteten för datavetenskaper [16801], Institutionen för programvaruteknik [16805])",2022,A Method for Enterprise Architecture Model Slicing,"<p>Enterprise Architecture (EA) has been applied widely in industry as it brings substantial benefits to ease communication and improve business-IT alignment. However, due to its high complexity and cost, EA still plays a limited role in many organizations. Existing research recommends realizing more of the EA potential. EA can be developed for specific purposes, accumulated in a digital repository, and reused when needed later. Due to the diversity and inconsistency of the repository, it is challenging to find relevant EA data and reuse it. In the present research, we propose using slicing techniques to extract EA models for reuse. We validate the method with an official EA repository hosted by The Open Group. The result shows that the method could facilitate extracting existing EA model components for developing new EA artifacts to save cost, alleviate maintenance effort, and help keep the repository consistent for future (re)use.</p>",https://bth.diva-portal.org/smash/get/diva2:1706904/FULLTEXT01.pdf
Vieira_332_2022,"Vieira, Renan (Federal University of Ceará Fortaleza, BRA);Mesquita, Diego (Getulio Vargas Foundation Rio de Janeiro, BRA);Mattos, César Lincoln (Federal University of Ceará Fortaleza, BRA);Britto, Ricardo [rbr] [0000-0002-7220-9570] (Blekinge Tekniska Högskola [16500], Fakulteten för datavetenskaper [16801], Institutionen för programvaruteknik [16805]);Rocha, Lincoln (Federal University of Ceará Fortaleza, BRA);Gomes, João (Federal University of Ceará Fortaleza, BRA)",2022,Bayesian Analysis of Bug-Fixing Time using Report Data,"<p>Background: Bug-fixing is the crux of software maintenance. It entails tending to heaps of bug reports using limited resources. Using historical data, we can ask questions that contribute to betterinformed allocation heuristics. The caveat here is that often there is not enough data to provide a sound response. This issue is especially prominent for young projects. Also, answers may vary from project to project. Consequently, it is impossible to generalize results without assuming a notion of relatedness between projects.</p><p>Aims: Evaluate the independent impact of three report features in the bug-fixing time (BFT), generalizing results from many projects: bug priority, code-churn size in bug fixing commits, and existence of links to other reports (e.g., depends on or blocks other bug reports).</p><p>Method: We analyze 55 projects from the Apache ecosystem using Bayesian statistics. Similar to standard random effects methodology, we assume each project's average BFT is a dispersed version of a global average BFT that we want to assess. We split the data based on feature values/range (e.g., with or without links). For each split, we compute a posterior distribution over its respective global BFT. Finally, we compare the posteriors to establish the feature's effect on the BFT. We run independent analyses for each feature.</p><p>Results: Our results show that the existence of links and higher code-churn values lead to BFTs that are at least twice as long. On the other hand, considering three levels of priority (low, medium, and high), we observe no difference in the BFT.</p><p>Conclusion: To the best of our knowledge, this is the first study using hierarchical Bayes to extrapolate results from multiple projects and assess the global effect of different attributes on the BFT. We use this methodology to gain insight on how links, priority, and code-churn size impact the BFT. On top of that, our posteriors can be used as a prior to analyze novel projects, potentially young and scarce on data. We also believe our methodology can be reused for other generalization studies in empirical software engineering. © 2022 Association for Computing Machinery.</p>",https://bth.diva-portal.org/smash/get/diva2:1709349/FULLTEXT01.pdf
