citationid,Name,Year,Title,Abstract,FullTextLink
Moyón_208_2024,"Moyón, Fabiola (Technical University of Munich, Germany);Angermeir, Florian (Fortiss, Germany);Mendez, Daniel [dmz] [0000-0003-0619-6027] (Blekinge Tekniska Högskola [16500], Fakulteten för datavetenskaper [16801], Institutionen för programvaruteknik [16805])",2024,Industrial Challenges in Secure Continuous Development,"<p>The intersection between security and continuous software engineering has been of great interest since the early years of the agile development movement, and it remains relevant as software development processes are more frequently guided by agility and the adoption of DevOps. Several authors have contributed studies about the framing of secure agile development and secure DevOps, motivating academic contributions to methods and practices, but also discussions around benefits and challenges. Especially the challenges captured also our interest since, for the last few years, we are conducting research on secure continuous software engineering from a more applied, practical perspective with the overarching aim to introduce solutions that can be adopted at scale. The short positioning at hands summarizes a relevant part of our endeavors in which we validated challenges with several practitioners of different roles. More than framing a set of challenges, we conclude by presenting four key research directions we identified for practitioners and researchers to delineate future work. Copyright © 2024 held by the owner/author(s).</p>",https://bth.diva-portal.org/smash/get/diva2:1873372/FULLTEXT01.pdf
vanDreven_328_2024,"van Dreven, Jonne [jva] [0000-0002-5229-1140] (Blekinge Tekniska Högskola [16500], Fakulteten för datavetenskaper [16801], Institutionen för datavetenskap [881506]);Cheddad, Abbas [abc] [0000-0002-4390-411X] (Blekinge Tekniska Högskola [16500], Fakulteten för datavetenskaper [16801], Institutionen för datavetenskap [881506]);Alawadi, Sadi [sci] [0000-0002-6309-2892] (Blekinge Tekniska Högskola [16500], Fakulteten för datavetenskaper [16801], Institutionen för datavetenskap [881506]);Ghazi, Ahmad Nauman [ngh] [0000-0001-9336-4361] (Blekinge Tekniska Högskola [16500], Fakulteten för datavetenskaper [16801], Institutionen för programvaruteknik [16805]);Al Koussa, Jad (Flemish Institute for Technological Research (VITO), Belgium);Vanhoudt, Dirk (Flemish Institute for Technological Research (VITO), Belgium)",2024,SHEDAD : SNN-Enhanced District Heating Anomaly Detection for Urban Substations,"<p>District Heating (DH) systems are essential for energy-efficient urban heating. However, despite the advancements in automated fault detection and diagnosis (FDD), DH still faces challenges in operational faults that impact efficiency. This study introduces the Shared Nearest Neighbor Enhanced District Heating Anomaly Detection (SHEDAD) approach, designed to approximate the DH network topology and allow for local anomaly detection without disclosing sensitive information, such as substation locations. The approach leverages a multi-Adaptive k-Nearest Neighbor (k-NN) graph to improve the initial neighborhood creation. Moreover, it introduces a merging technique that reduces noise and eliminates trivial edges. We use the Median Absolute Deviation (MAD) and modified z-scores to flag anomalous substations. The results reveal that SHEDAD outperforms traditional clustering methods, achieving significantly lower intra-cluster variance and distance. Additionally, SHEDAD effectively isolates and identifies two distinct categories of anomalies: supply temperatures and substation performance. We identified 30 anomalous substations and reached a sensitivity of approximately 65% and specificity of approximately 97%. By focusing on this subset of poor-performing substations in the network, SHEDAD enables more targeted and effective maintenance interventions, which can reduce energy usage while optimizing network performance. © 2024 IEEE.</p>",https://bth.diva-portal.org/smash/get/diva2:1914024/FULLTEXT01.pdf
Angermeir_17_2024,"Angermeir, Florian [fau] [0000-0001-7903-8236] (Blekinge Tekniska Högskola [16500], Fakulteten för datavetenskaper [16801], Institutionen för programvaruteknik [16805]);Fischbach, Jannik (Fortiss, Germany);Moyón, Fabiola (Siemens Technology, Germany);Mendez, Daniel [dmz] [0000-0003-0619-6027] (Blekinge Tekniska Högskola [16500], Fakulteten för datavetenskaper [16801], Institutionen för programvaruteknik [16805])",2024,Towards Automated Continuous Security Compliance,"<p>Context: Continuous Software Engineering is increasingly adopted in highly regulated domains, raising the need for continuous compliance. Adherence to especially security regulations - a major concern in highly regulated domains - renders Continuous Security Compliance of high relevance to industry and research.</p><p>Problem: One key barrier to adopting continuous software engineering in the industry is the resource-intensive and error-prone nature of traditional manual security compliance activities. Automation promises to be advantageous. However, continuous security compliance is under-researched, precluding an effective adoption.</p><p>Contribution: We have initiated a long-term research project with our industry partner to address these issues. In this manuscript, we make three contributions: (1) We provide a precise definition of the term continuous security compliance aligning with the state-of-art, (2) elaborate a preliminary overview of challenges in the field of automated continuous security compliance through a tertiary literature study, and (3) present a research roadmap to address those challenges via automated continuous security compliance. © 2024 ACM.</p>",
Paudel_232_2025,"Paudel, Bhuwan [bpu] [0009-0004-5806-6624] (Blekinge Tekniska Högskola [16500], Fakulteten för datavetenskaper [16801], Institutionen för programvaruteknik [16805]);Gonzalez-Huerta, Javier [jgh] [0000-0003-1350-7030] (Blekinge Tekniska Högskola [16500], Fakulteten för datavetenskaper [16801], Institutionen för programvaruteknik [16805]);Mendez, Daniel [dmz] [0000-0003-0619-6027] (Blekinge Tekniska Högskola [16500], Fakulteten för datavetenskaper [16801], Institutionen för programvaruteknik [16805]);Klotins, Eriks [ekx] [0000-0002-1987-2234] (Blekinge Tekniska Högskola [16500], Fakulteten för datavetenskaper [16801], Institutionen för programvaruteknik [16805])",2025,A Data-Driven Approach to Optimize Internal Software Quality and Customer Value Delivery,"<p>The growing complexity, the ever-ending demands for new features, and the need to become faster to remain competitive force software development organizations to rethink their development and value delivery practices. While continuous delivery has become more popular, it still relies mainly on internal metrics, ad-hoc data, and expert opinions. As a result, software organizations stumble to find the balance between improving internal system quality and delivering external value. In fact, understanding and measuring customer value is on itself essential. In this PhD project, we aim for a better understanding of customer value and develop measurement instruments to be integrated with internal perspectives to drive proactive and continuous internal improvement while delivering relevant customer value. </p>",
Badampudi_27_2025,"Badampudi, Deepika [deb] [0000-0002-6215-1774] (Blekinge Tekniska Högskola [16500], Fakulteten för datavetenskaper [16801], Institutionen för programvaruteknik [16805]);Usman, Muhammad [muu] [0000-0002-8132-0107] (Blekinge Tekniska Högskola [16500], Fakulteten för datavetenskaper [16801], Institutionen för programvaruteknik [16805]);Chen, Xingru [xcn] [0000-0003-1181-9049] (Blekinge Tekniska Högskola [16500], Fakulteten för datavetenskaper [16801], Institutionen för programvaruteknik [16805])",2025,Large scale reuse of microservices using CI/CD and InnerSource practices - a case study,"<p>Contemporary practices such as InnerSource (adopting open source practices within an organization), continuous integration and delivery (CI/CD), and the use of microservices promote software reuse. Although the benefits of individual contemporary practices on reuse may be known, the implications of collective contemporary practices, mainly challenges and improvements to mitigate the challenges, are to a large extent unknown. In this study, we investigate the additional effort (cost factors), benefits, challenges, and potential improvements in contemporary reuse at Ericsson.</p><p>We performed the study in two phases: a) the initial data collection based on a combination of data collection methods (e.g., interviews, discussions, company portals), and b) a follow-up group discussion after a year to understand the status of the challenges and improvements identified in the first phase.</p><p>Our results indicate that developing reusable assets resulted in upfront cost factors, such as additional effort in ensuring compliance. Furthermore, development with reuse also resulted in cost factors, for example, additional effort in integrating and understanding reusable assets. Ericsson perceived the cost factors as an investment resulting in long-term benefits such as improved quality, productivity, customer experience, and way of working. The main challenge faced by Ericsson was the pressure on the producers of reusable assets. Our study shows how InnerSource can lead to an increase in contributions to reusable assets. Furthermore, Ericsson implemented measures like automating compliance checks that improved the maturity of reusable assets, resulting in an increase in their reuse.</p><p>In summary, effective use of contemporary practices such as InnerSource and CI/CD, along with the use of microservices, can facilitate large scale reuse. © The Author(s) 2024.</p>",https://bth.diva-portal.org/smash/get/diva2:1923599/FULLTEXT01.pdf
Tkalich_305_2025,"Tkalich, Anastasiia [atk] [0000-0001-7391-4194] (SINTEF, Norway);Klotins, Eriks [ekx] [0000-0002-1987-2234] (Blekinge Tekniska Högskola [16500], Fakulteten för datavetenskaper [16801], Institutionen för programvaruteknik [16805]);Sporsem, Tor (SINTEF, Norway);Stray, Viktoria (SINTEF, Norway);Moe, Nils Brede [nbm] [0000-0003-2669-0778] (Blekinge Tekniska Högskola [16500], Fakulteten för datavetenskaper [16801], Institutionen för programvaruteknik [16805]);Barbala, Astri (SINTEF, Norway)",2025,User feedback in continuous software engineering : revealing the state-of-practice,"<p>Context: Organizations opt for continuous delivery of incremental updates to deal with uncertainty and minimize waste. However, applying continuous engineering (CSE) practices requires a continuous feedback loop with input from customers and end-users.</p><p>Challenges: It becomes increasingly challenging to apply traditional requirements elicitation and validation techniques with ever-shrinking software delivery cycles. At the same time, frequent deliveries generate an abundance of usage data and telemetry informing engineering teams of end-user behavior. The literature describing how practitioners work with user feedback in CSE, is limited.</p><p>Objectives: We aim to explore the state of practice related to utilization of user feedback in CSE. Specifically, what practices are used, how, and the shortcomings of these practices.</p><p>Method: We conduct a qualitative survey and report analysis from 21 interviews in 13 product development companies. We apply thematic and cross-case analysis to interpret the data. Results: Based on our earlier work we suggest a conceptual model of how user feedback is utilized in CSE. We further report the identified challenges with the continuous collection and analysis of user feedback and identify implications for practice.</p><p>Conclusions: Companies use a combination of qualitative and quantitative methods to infer end-user preferences. At the same time, continuous collection, analysis, interpretation, and use of data in decisions are problematic. The challenges pertain to selecting the right metrics and analysis techniques, resource allocation, and difficulties in accessing vaguely defined user groups. Our advice to practitioners in CSE is to ensure sufficient resources and effort for interpretation of the feedback, which can be facilitated by telemetry dashboards. </p>",https://bth.diva-portal.org/smash/get/diva2:1946346/FULLTEXT01.pdf
Schwarz_271_2025,"Schwarz, Georg-Daniel (Friedrich-Alexander-Universität Erlangen-Nürnberg, Germany);Bauer, Andreas [aur] [0000-0002-2916-4020] (Blekinge Tekniska Högskola [16500], Fakulteten för datavetenskaper [16801], Institutionen för programvaruteknik [16805]);Riehle, Dirk (Friedrich-Alexander-Universität Erlangen-Nürnberg, Germany);Harutyunyan, Nikolay (Friedrich-Alexander-Universität Erlangen-Nürnberg, Germany)",2025,A taxonomy of microservice integration techniques,"<p>Context: Microservices have become an important architectural style for building robust and scalable software systems. A system's functionality is split into independent units, the microservices, that communicate over a network and can be deployed independently. The shift of complexity into the integration layer necessitates enhanced collaboration among stakeholders, stressing the importance of effective communication.</p><p>Objective: We aim to streamline communication between stakeholders in microservice-based projects by constructing a framework for enhanced clarity, a taxonomy, by answering our research question: “How can microservice integration techniques be classified?”</p><p>Method: We conducted a thematic analysis of literature and six expert interviews to identify microservice integration techniques and construct a taxonomy.</p><p>Results: The results of this study are (i) a taxonomy for microservice integration techniques consisting of five main and ten refined categories, (ii) the classification of 121 found integration techniques, (iii) an illustration of the taxonomy usage based on three selected techniques to demonstrate the procedure in case of classification ambiguity, (iv) a comparison of data gathered from literature with the interviews, and (v) comprehensive supplementary materials.</p><p>Conclusion: The taxonomy offers a structured framework to classify microservice integration techniques and enhances the understanding of the diverse landscape of microservice integration techniques, including organizational ones that are often overlooked. Practitioners can discover integration techniques through the taxonomy and apply them with guidance provided in the supplementary materials. </p>",https://bth.diva-portal.org/smash/get/diva2:1951764/FULLTEXT01.pdf
