citationid,Name,Year,Title,Abstract,FullTextLink
Auer_20_2021,"Auer, Florian (University of Innsbruck, AUT);Ros, Rasmus (Lund University, SWE);Kaltenbrunner, Lukas (University of Innsbruck, AUT);Runeson, Per (Lund University, SWE);Felderer, Michael [mfd] [0000-0003-3818-4442] (Blekinge Tekniska Högskola [16500], Fakulteten för datavetenskaper [16801], Institutionen för programvaruteknik [16805])",2021,Controlled experimentation in continuous experimentation : Knowledge and challenges,"<p>Context: Continuous experimentation and A/B testing is an established industry practice that has been researched for more than 10 years. Our aim is to synthesize the conducted research. Objective: We wanted to find the core constituents of a framework for continuous experimentation and the solutions that are applied within the field. Finally, we were interested in the challenges and benefits reported of continuous experimentation. Methods: We applied forward snowballing on a known set of papers and identified a total of 128 relevant papers. Based on this set of papers we performed two qualitative narrative syntheses and a thematic synthesis to answer the research questions. Results: The framework constituents for continuous experimentation include experimentation processes as well as supportive technical and organizational infrastructure. The solutions found in the literature were synthesized to nine themes, e.g. experiment design, automated experiments, or metric specification. Concerning the challenges of continuous experimentation, the analysis identified cultural, organizational, business, technical, statistical, ethical, and domain-specific challenges. Further, the study concludes that the benefits of experimentation are mostly implicit in the studies. Conclusion: The research on continuous experimentation has yielded a large body of knowledge on experimentation. The synthesis of published research presented within include recommended infrastructure and experimentation process models, guidelines to mitigate the identified challenges, and what problems the various published solutions solve. © 2021 The Authors</p>",https://bth.diva-portal.org/smash/get/diva2:1534068/FULLTEXT01.pdf
Wohlin_349_2021,"Wohlin, Claes [cwo] [0000-0003-0460-5253] (Blekinge Tekniska Högskola [16500], Fakulteten för datavetenskaper [16801], Institutionen för programvaruteknik [16805]);Papatheocharous, Efi (RISE Research Institutes of Sweden AB, SWE);Carlson, Jan (Mälardalen University, SWE);Petersen, Kai [kps] [0000-0002-1532-8223] (Blekinge Tekniska Högskola [16500], Fakulteten för datavetenskaper [16801], Institutionen för programvaruteknik [16805]);Alégroth, Emil [EAL] [0000-0001-7526-3727] (Blekinge Tekniska Högskola [16500], Fakulteten för datavetenskaper [16801], Institutionen för programvaruteknik [16805]);Axelsson, Jakob (Mälardalen University, SWE);Badampudi, Deepika [deb] [0000-0002-6215-1774] (Blekinge Tekniska Högskola [16500], Fakulteten för datavetenskaper [16801], Institutionen för programvaruteknik [16805]);Borg, Markus (RISE Research Institutes of Sweden AB, SWE);Cicchetti, Antonio (Mälardalen University, SWE);Ciccozzi, Federico (Mälardalen University, SWE);Olsson, Thomas (RISE Research Institutes of Sweden AB);Sentilles, Séverine (Mälardalen University, SWE);Svahnberg, Mikael [msv] (Blekinge Tekniska Högskola [16500], Fakulteten för datavetenskaper [16801], Institutionen för programvaruteknik [16805]);Wnuk, Krzysztof [krw] [0000-0003-3567-9300] (Blekinge Tekniska Högskola [16500], Fakulteten för datavetenskaper [16801], Institutionen för programvaruteknik [16805]);Gorschek, Tony [tgo] [0000-0002-3646-235x] (Blekinge Tekniska Högskola [16500], Fakulteten för datavetenskaper [16801], Institutionen för programvaruteknik [16805])",2021,Towards evidence-based decision-making for identification and usage of assets in composite software : A research roadmap,"<p>Software engineering is decision intensive. Evidence-based software engineering is suggested for decision-making concerning the use of methods and technologies when developing software. Software development often includes the reuse of software assets, for example, open-source components. Which components to use have implications on the quality of the software (e.g., maintainability). Thus, research is needed to support decision-making for composite software. This paper presents a roadmap for research required to support evidence-based decision-making for choosing and integrating assets in composite software systems. The roadmap is developed as an output from a 5-year project in the area, including researchers from three different organizations. The roadmap is developed in an iterative process and is based on (1) systematic literature reviews of the area; (2) investigations of the state of practice, including a case survey and a survey; and (3) development and evaluation of solutions for asset identification and selection. The research activities resulted in identifying 11 areas in need of research. The areas are grouped into two categories: areas enabling evidence-based decision-making and those related to supporting the decision-making. The roadmap outlines research needs in these 11 areas. The research challenges and research directions presented in this roadmap are key areas for further research to support evidence-based decision-making for composite software. © 2021 The Authors. Journal of Software: Evolution and Process published by John Wiley &amp; Sons Ltd.</p>",https://bth.diva-portal.org/smash/get/diva2:1540119/FULLTEXT01.pdf
Auer_19_2021,"Auer, Florian (University of Innsbruck, AUT);Lenarduzzi, Valentina (LUT University, FIN);Felderer, Michael [mfd] [0000-0003-3818-4442] (Blekinge Tekniska Högskola [16500], Fakulteten för datavetenskaper [16801], Institutionen för programvaruteknik [16805]);Taibi, Davide (Tampere University, FIN)",2021,From monolithic systems to Microservices : An assessment framework,"<p>Context: Re-architecting monolithic systems with Microservices-based architecture is a common trend. Various companies are migrating to Microservices for different reasons. However, making such an important decision like re-architecting an entire system must be based on real facts and not only on gut feelings. Objective: The goal of this work is to propose an evidence-based decision support framework for companies that need to migrate to Microservices, based on the analysis of a set of characteristics and metrics they should collect before re-architecting their monolithic system. Method: We conducted a survey done in the form of interviews with professionals to derive the assessment framework based on Grounded Theory. Results: We identified a set consisting of information and metrics that companies can use to decide whether to migrate to Microservices or not. The proposed assessment framework, based on the aforementioned metrics, could be useful for companies if they need to migrate to Microservices and do not want to run the risk of failing to consider some important information. © 2021 The Author(s)</p>",https://bth.diva-portal.org/smash/get/diva2:1555011/FULLTEXT01.pdf
Avritzer_22_2021,"Avritzer, Alberto A. (ESulab Solutions, USA);Camilli, Matteo (Free University of Bozen-Bolzano, ITA);Janes, Andrea (Free University of Bozen-Bolzano, ITA);Russo, Barbara (Free University of Bozen-Bolzano, ITA);Jahic, Jasmin (University of Cambridge, GBR);Hoorn, André Van (University of Stuttgart, DEU);Britto, Ricardo [rbr] [0000-0002-7220-9570] (Blekinge Tekniska Högskola [16500], Fakulteten för datavetenskaper [16801], Institutionen för programvaruteknik [16805]);Trubiani, Catia (Gran Sasso Science Institute, ITA)",2021,"PPTAMλ : What, Where, and How of Cross-domain Scalability Assessment","<p>Software development ecosystems vary significantly among different industrial domains. Therefore, it is challenging to establish quality assurance processes that can be deployed seamlessly to multiple domains. In this paper, we extend our previous work on performance and scalability assessment by identifying the architecture variability points in our PPTAM tooling infrastructure. The goal is to design a modifiable software architecture that enables low cost deployment of our performance and scalability assessment approach. We present the scalability assessment context, architecture modifiability, and lessons learned that were derived from our experience with scalability assessment in several business domains. Specifically, we describe our experience with the application of the proposed approach to a large complex telecom system at Ericsson. © 2021 IEEE.</p>",
Irshad_147_2021,"Irshad, Mohsin [MIR] (Ericsson Sweden AB, Sweden);Petersen, Kai [kps] [0000-0002-1532-8223] (Blekinge Tekniska Högskola [16500], Fakulteten för datavetenskaper [16801], Institutionen för programvaruteknik [16805])",2021,A systematic reuse process for automated acceptance tests : Construction and elementary evaluation,"<p><strong>Context: </strong>Automated acceptance testing validates a product's functionality from the customer's perspective. Text-based automated acceptance tests (AATs) have gained popularity because they link requirements and testing.</p><p><strong>Objective:</strong> To propose and evaluate a cost-effective systematic reuse process for automated acceptance tests.</p><p><strong>Method:</strong> A systematic approach, method engineering, is used to construct a systematic reuse process for automated acceptance tests. The techniques to support searching, assessing, adapting the reusable tests are proposed and evaluated. The constructed process is evaluated using (i) qualitative feedback from software practitioners and (ii) a demonstration of the process in an industry setting. The process was evaluated for three constraints: performance expectancy, effort expectancy, and facilitating conditions.</p><p><strong>Results</strong>: The process consists of eleven activities that support development for reuse, development with reuse, and assessment of the costs and benefits of reuse. During the evaluation, practitioners found the process a useful method to support reuse. In the industrial demonstration, it was noted that the activities in the solution helped in developing an automated acceptance test with reuse faster than creating a test from scratch i.e., searching, assessment, and adaptation parts.</p><p><strong>Conclusion:</strong> The process is found to be useful and relevant to the industry during the preliminary investigation. </p>",https://bth.diva-portal.org/smash/get/diva2:1579815/FULLTEXT01.pdf
Angermeir_18_2021,"Angermeir, Florian (Tech Univ Munich, DEU);Voggenreiter, Markus (Siemens Technol, Mumbai, DEU);Moyon, Fabiola ( Tech Univ Munich, DEU);Mendez, Daniel [dmz] [0000-0003-0619-6027] (Blekinge Tekniska Högskola [16500], Fakulteten för datavetenskaper [16801], Institutionen för programvaruteknik [16805])",2021,Enterprise-Driven Open Source Software : A Case Study on Security Automation,"<p>Agile and DevOps are widely adopted by the industry. Hence, integrating security activities with industrial practices. such as continuous integration (CI) pipelines, is necessary to detect security flaws and adhere to regulators' demands early. In this paper, we analyze automated security activities in CI pipelines of enterprise-driven open source software (OSS). This shall allow us, in the long-run, to better understand the extent to which security activities are (or should be) part of automated pipelines. In particular, we mine publicly available OSS repositories and survey a sample of project maintainers to better understand the role that security activities and their related tools play in their CI pipelines. To increase transparency and allow other researchers to replicate our study (and to take different perspectives), we further disclose our research artefacts. Our results indicate that security activities in enterprise-driven OSS projects are scarce and protection coverage is rather low. Only 6.83% of the analyzed 8,243 projects apply security automation in their CI pipelines, even though maintainers consider security to be rather important. This alerts industry to keep the focus on vulnerabilities of 3rd Party software and it opens space for other improvements or practice which we outline in this manuscript.</p>",
Moyón_211_2021,"Moyón, Fabiola (Siemens Technology, DEU);Mendez, Daniel [dmz] [0000-0003-0619-6027] (Blekinge Tekniska Högskola [16500], Fakulteten för datavetenskaper [16801], Institutionen för programvaruteknik [16805]);Beckers, Kristian (Social Engineering Academy, DEU);Klepper, Sebastian (Technical University Munich TUM, DEU)",2021,Using Process Models to Understand Security Standards,"<p>Many industrial software development processes today have to comply with security standards such as the IEC 62443-4-1. These standards, written in natural language, are ambiguous and complex to understand. This is especially true for non-security experts. Security practitioners thus invest much effort into comprehending standards and, later, into introducing them to development teams. However, our experience in the industry shows that development practitioners might very well also read such standards, but nevertheless end up inviting experts for interpretation (or confirmation). Such a scenario is not in tune with current trends and needs of increasing velocity in continuous software engineering. In this paper, we propose a tool-supported approach to make security standards more precise and easier to understand for both non-security as well as security experts by applying process models. This approach emerges from a large industrial company and encompasses so far the IEC 62443-4–1 standard. We further present a case study with 16 industry practitioners showing how the approach improves communication between development and security compliance practitioners. © 2021, Springer Nature Switzerland AG.</p>",
vanHaastrecht_331_2021,"van Haastrecht, Max (Leiden University, NLD);Golpur, Guy (KPMG Somekh Chaikin, ISR);Tzismadia, Gilad (KPMG Somekh Chaikin, ISR);Kab, Rolan (KPMG Somekh Chaikin, ISR);Priboi, Cristian (CERT-RO, ROU);David, Dumitru (CERT-RO, ROU);Răcătăian, Adrian (CERT-RO, ROU);Baumgartner, Louis (University of Applied Sciences and Arts Northwestern Switzerland (FHNW), CHE);Fricker, Samuel [sfr] [0000-0001-7368-4448] (Blekinge Tekniska Högskola [16500], Fakulteten för datavetenskaper [16801], Institutionen för programvaruteknik [16805]);Ruiz, Jose Francisco (Atos SA, ESP);Armas, Esteban (Atos SA, ESP);Brinkhuis, Matthieu (Utrecht University, NLD);Spruit, Marco (Leiden University, NLD)",2021,A shared cyber threat intelligence solution for smes,"<p>Small-and medium-sized enterprises (SMEs) frequently experience cyberattacks, but often do not have the means to counter these attacks. Therefore, cybersecurity researchers and practitioners need to aid SMEs in their defence against cyber threats. Research has shown that SMEs require solutions that are automated and adapted to their context. In recent years, we have seen a surge in initiatives to share cyber threat intelligence (CTI) to improve collective cybersecurity resilience. Shared CTI has the potential to answer the SME call for automated and adaptable solutions. Sadly, as we demonstrate in this paper, current shared intelligence approaches scarcely address SME needs. We must investigate how shared CTI can be used to improve SME cybersecurity resilience. In this paper, we tackle this challenge using a systematic review to discover current state-of-the-art approaches to using shared CTI. We find that threat intelligence sharing platforms such as MISP have the potential to address SME needs, provided that the shared intelligence is turned into actionable insights. Based on this observation, we developed a prototype application that processes MISP data automatically, prioritises cybersecurity threats for SMEs, and provides SMEs with actionable recommendations tailored to their context. Subsequent evaluations in operational environments will help to improve our application, such that SMEs are enabled to thwart cyberattacks in future. © 2021 by the authors. Licensee MDPI, Basel, Switzerland.</p>",https://bth.diva-portal.org/smash/get/diva2:1637058/FULLTEXT01.pdf
Singh_285_2022,"Singh, Shailesh Pratap [sip] [0000-0002-2015-407X] (Blekinge Tekniska Högskola [16500], Fakulteten för datavetenskaper [16801], Institutionen för datavetenskap [881506]);Ali, Nauman bin [nal] [0000-0001-7266-5632] (Blekinge Tekniska Högskola [16500], Fakulteten för datavetenskaper [16801], Institutionen för programvaruteknik [16805]);Lundberg, Lars [llu] (Blekinge Tekniska Högskola [16500], Fakulteten för datavetenskaper [16801], Institutionen för datavetenskap [881506])",2022,Smart and Adaptive Architecture for a Dedicated Internet of Things Network Comprised of Diverse Entities : A Proposal and Evaluation,"<p>Advances in 5G and the Internet of Things (IoT) have to cater to the diverse and varying needs of different stakeholders, devices, sensors, applications, networks, and access technologies that come together for a dedicated IoT network for a synergistic purpose. Therefore, there is a need for a solution that can assimilate the various requirements and policies to dynamically and intelligently orchestrate them in the dedicated IoT network. Thus we identify and describe a representative industry-relevant use case for such a smart and adaptive environment through interviews with experts from a leading telecommunication vendor. We further propose and evaluate candidate architectures to achieve dynamic and intelligent orchestration in such a smart environment using a systematic approach for architecture design and by engaging six senior domain and IoT experts. The candidate architecture with an adaptive and intelligent element (“Smart AAA agent”) was found superior for modifiability, scalability, and performance in the assessments. This architecture also explores the enhanced role of authentication, authorization, and accounting (AAA) and makes the base for complete orchestration. The results indicate that the proposed architecture can meet the requirements for a dedicated IoT network, which may be used in further research or as a reference for industry solutions. © 2022 by the authors. Licensee MDPI, Basel, Switzerland.</p>",https://bth.diva-portal.org/smash/get/diva2:1654986/FULLTEXT01.pdf
Usman_324_2022,"Usman, Muhammad [muu] [0000-0002-8132-0107] (Blekinge Tekniska Högskola [16500], Fakulteten för datavetenskaper [16801], Institutionen för programvaruteknik [16805]);Badampudi, Deepika [deb] [0000-0002-6215-1774] (Blekinge Tekniska Högskola [16500], Fakulteten för datavetenskaper [16801], Institutionen för programvaruteknik [16805]);Smith, Chris (Ericsson AB, SWE);Nayak, Himansu (Ericsson AB, SWE)",2022,An Ecosystem for the Large-Scale Reuse of Microservices in a Cloud-Native Context,"<p>This article presents an ecosystem that Ericsson developed to systematically practice large-scale reuse of microservices in a cloud-native context. We discuss how various ecosystem aspects, such as its continuous delivery mechanism, marketplace, and automated checking of design rules, facilitated the development and reuse of microservices across Ericsson. We also share lessons learned while developing the ecosystem including the initiatives related to the adoption of InnerSource practices for sustaining the ecosystem. </p>",https://bth.diva-portal.org/smash/get/diva2:1656647/FULLTEXT01.pdf
Klotins_161_2022,"Klotins, Eriks [ekx] [0000-0002-1987-2234] (Blekinge Tekniska Högskola [16500], Fakulteten för datavetenskaper [16801], Institutionen för programvaruteknik [16805]);Gorschek, Tony [tgo] [0000-0002-3646-235x] (Blekinge Tekniska Högskola [16500], Fakulteten för datavetenskaper [16801], Institutionen för programvaruteknik [16805])",2022,Continuous Software Engineering in the Wild,"<p>Software is becoming a critical component of most products and organizational functions. The ability to continuously improve software determines how well the organization can respond to market opportunities. Continuous software engineering promises numerous advantages over sprint-based or plan-driven development. However, implementing a continuous software engineering pipeline in an existing organization is challenging. In this invited position paper, we discuss the adoption challenges and argue for a more systematic methodology to drive the adoption of continuous engineering. Our discussion is based on ongoing work with several industrial partners as well as experience reported in both state-of-practice and state-of-the-art. We conclude that the adoption of continuous software engineering primarily requires analysis of the organization, its goals, and constraints. One size does not fit all purposes, meaning that many of the principles behind continuous engineering are relevant for most organizations, but the level of realization and the benefits may still vary. The main hindrances to continuous flow of software arise from sub-optimal organizational structures and the lack of alignment. Once those are removed, the organization can implement automation to further improve the software delivery. © 2022, Springer Nature Switzerland AG.</p>",
Klotins_162_2022,"Klotins, Eriks [ekx] [0000-0002-1987-2234] (Blekinge Tekniska Högskola [16500], Fakulteten för datavetenskaper [16801], Institutionen för programvaruteknik [16805]);Gorschek, Tony [tgo] [0000-0002-3646-235x] (Blekinge Tekniska Högskola [16500], Fakulteten för datavetenskaper [16801], Institutionen för programvaruteknik [16805]);Sundelin, Katarina (Ericsson AB Karlskrona, SWE);Falk, Erik (Telia Co Uppsala, SWE)",2022,Towards cost-benefit evaluation for continuous software engineering activities,"<p>Context: Software companies must become better at delivering software to remain relevant in the market. Continuous integration and delivery practices promise to streamline software deliveries to end-users by implementing an automated software development and delivery pipeline. However, implementing or retrofitting an organization with such a pipeline is a substantial investment, while the reporting on benefits and their relevance in specific contexts/domains are vague. Aim: In this study, we explore continuous software engineering practices from an investment-benefit perspective. We identify what benefits can be attained by adopting continuous practices, what the associated investments and risks are, and analyze what parameters determine their relevance. Method: We perform a multiple case study to understand state-of-practice, organizational aims, and challenges in adopting continuous software engineering practices. We compare state-of-practice with state-of-the-art to validate the best practices and identify relevant gaps for further investigation. Results: We found that companies start the CI/CD adoption by automating and streamlining the internal development process with clear and immediate benefits. However, upgrading customers to continuous deliveries is a major obstacle due to existing agreements and customer push-back. Renegotiating existing agreements comes with a risk of losing customers and disrupting the whole organization. Conclusions: We conclude that the benefits of CI/CD are overstated in literature without considering the contextual and domain complexities rendering some benefits infeasible. We identify the need to understand the customer and organizational perspectives further and understand the contextual requirements towards the CI/CD.</p>",https://bth.diva-portal.org/smash/get/diva2:1691652/FULLTEXT01.pdf
Chen_48_2022,"Chen, Xingru [xcn] [0000-0003-1181-9049] (Blekinge Tekniska Högskola [16500], Fakulteten för datavetenskaper [16801], Institutionen för programvaruteknik [16805]);Badampudi, Deepika [deb] [0000-0002-6215-1774] (Blekinge Tekniska Högskola [16500], Fakulteten för datavetenskaper [16801], Institutionen för programvaruteknik [16805]);Usman, Muhammad [muu] [0000-0002-8132-0107] (Blekinge Tekniska Högskola [16500], Fakulteten för datavetenskaper [16801], Institutionen för programvaruteknik [16805])",2022,Reuse in Contemporary Software Engineering Practices - An Exploratory Case Study in A Medium-sized Company,"<p>Background: Software practice is evolving with changing technologies and practices such as InnerSource, DevOps, and microservices. It is important to investigate the impact of contemporary software engineering (SE) practices on software reuse.Aim: This study aims to characterize software reuse in contemporary SE practices and investigate its implications in terms of costs, benefits, challenges, and potential improvements in a medium-sized company.Method: We performed an exploratory case study by conducting interviews, group discussions, and reviewing company documentation to investigate software reuse in the context of contemporary SE practices in the case company.Results: The results indicate that the development for reuse in contemporary SE practices incurs additional coordination, among other costs. Development with reuse led to relatively fewer additional costs and resulted in several benefits such as better product quality and less development and delivery time. Ownership of reusable assets is challenging in contemporary SE practice. InnerSource practices may help mitigate the top perceived challenges: discoverability and ownership of the reusable assets, knowledge sharing and reuse measurement.Conclusion: Reuse in contemporary SE practices is not without additional costs and challenges. However, the practitioners perceive costs as investments that benefit the company in the long run.</p>",https://bth.diva-portal.org/smash/get/diva2:1696267/FULLTEXT01.pdf
