citationid,Name,Year,Title,Abstract,FullTextLink
Klotins_164_2022,"Klotins, Eriks [ekx] [0000-0002-1987-2234] (Blekinge Tekniska Högskola [16500], Fakulteten för datavetenskaper [16801], Institutionen för programvaruteknik [16805]);Peretz-Andersson, Einav (Jonkoping University, SWE)",2022,The unified perspective of digital transformation and continuous software engineering,"<p>Software is a key component of most products, services, industrial processes, and back-office functions. Thus, companies may gain an advantage by establishing fast feedback cycles to improve their software. Continuous software engineering (CI/CD) is being primarily studied as an engineering topic. However, the rest of the organization needs to align and be prepared to utilize the benefits of CI/CD. In this paper, we explore the overlap between CI/CD and digital transformation (DT). We study literature in both areas to develop a map of conditions, mechanisms, and outcomes. As a result, we present a unified perspective of CI/CD and DT. We found that CI/CD can be seen as an implementation of DT in a software organization. DT perspective can help to guide the adoption of CI/CD from an organizational perspective.</p>",
Šmite_379_2023,"Šmite, Darja [xds] [0000-0003-1744-3118] (Blekinge Tekniska Högskola [16500], Fakulteten för datavetenskaper [16801], Institutionen för programvaruteknik [16805]);Moe, Nils Brede [nbm] [0000-0003-2669-0778] (Blekinge Tekniska Högskola [16500], Fakulteten för datavetenskaper [16801], Institutionen för programvaruteknik [16805]);Klotins, Eriks [ekx] [0000-0002-1987-2234] (Blekinge Tekniska Högskola [16500], Fakulteten för datavetenskaper [16801], Institutionen för programvaruteknik [16805]);Gonzalez-Huerta, Javier [jgh] [0000-0003-1350-7030] (Blekinge Tekniska Högskola [16500], Fakulteten för datavetenskaper [16801], Institutionen för programvaruteknik [16805])",2023,From forced Working-From-Home to voluntary working-from-anywhere : Two revolutions in telework,"<p>The COVID-19 outbreak has admittedly caused interruptions to production, transportation, and mobility, therefore, having a significant impact on the global supply and demand chain's well-functioning. But what happened to companies developing digital services, such as software? How has the enforced Working-From-Home (WFH) mode impacted their ability to deliver software, if at all? This article shares our findings from monitoring the WFH during 2020 in an international software company with engineers located in Sweden, the USA, and the UK. We analyzed different aspects of productivity, such as developer job satisfaction and well-being, activity, communication and collaboration, efficiency and flow based on the archives of commit data, calendar invites, Slack communication, the internal reports of WFH experiences, and 30 interviews carried out in April/May and September 2020. We add more objective evidence to the existing COVID-19 studies the vast majority of which are based on self-reported productivity from the early months of the pandemic. We find that engineers continue committing code and carrying out their daily duties, as their routines adjust to “the new norm”. Our key message is that software engineers can work from home and quickly adjust their tactical approaches to the changes of unprecedented scale. Further, WFH has its benefits, including better work-life balance, improved flow, and improved quality of distributed meetings and events. Yet, WFH is not challenge free: not everybody feels equally productive working from home, work hours for many increased, while physical activity, socialization, pairing and opportunities to connect to unfamiliar colleagues decreased. Information sharing and meeting patterns also changed. Finally, experiences gained during the pandemic will have a lasting impact on the future of the workplace. The results of an internal company-wide survey suggest that only 9% of engineers will return to work in the office full time. Our article concludes with the InterSoft's strategy for work from anywhere (WFX), and a list of useful adjustments for a better WFH. © 2022 The Author(s)</p>",https://bth.diva-portal.org/smash/get/diva2:1705188/FULLTEXT01.pdf
Alexandre_8_2023,"Alexandre, Rui Carlos Josino (UNIFESP,  Brazil);Martins, Luiz Eduardo Galvao (UNIFESP,  Brazil);Gorschek, Tony [tgo] [0000-0002-3646-235x] (Blekinge Tekniska Högskola [16500], Fakulteten för datavetenskaper [16801], Institutionen för programvaruteknik [16805])",2023,Cybersecurity Risk Assessment for Medium-Risk Drones : A Systematic Literature Review,"<p>The increased demand for Remotely Piloted Aircraft Systems (RPAS) in Beyond Visual Line-Of-Sight (BVLOS) operations gives rise to a set of concerns regarding cybersecurity that, if not addressed, can lead to the unsafe operation of RPASs. To assist the airworthiness evaluation that is performed by Civil Aviation Authorities (CAAs), we identified several processes that are used to evaluate the cybersecurity of RPAS. We conducted a Systematic Literature Review (SLR) by selecting 30 papers (out of 211 screened) that were published during the past five years. The results of our SLR indicate the importance of cybersecurity to the safe operation of RPAS. It is evident that there is a lack of a systematic process to enable a cybersecurity review of RPAS. We observe that common cyber threats to RPAS are related to jamming, spoofing, and DOS/DDOS (Denial of Service/Distributed Denial of Service). Processes relevant to the assessment of RPAS cybersecurity exist, however they differ in safety concerns from our perspective. In addition, with only one exception, the methods have not been used, and/or the use has not been reported as pertaining to industrial application. The most frequently cited vulnerabilities are those related to GPS and datalinks. </p>",
Klotins_163_2023,"Klotins, Eriks [ekx] [0000-0002-1987-2234] (Blekinge Tekniska Högskola [16500], Fakulteten för datavetenskaper [16801], Institutionen för programvaruteknik [16805]);Gorschek, Tony [tgo] [0000-0002-3646-235x] (Blekinge Tekniska Högskola [16500], Fakulteten för datavetenskaper [16801], Institutionen för programvaruteknik [16805]);Wilson, Magnus (Ericsson AB, Sweden)",2023,Continuous Software Engineering : Introducing an Industry Readiness Model,"<p>Software is becoming essential for most products, manufacturing processes, and back-office functions. The speed of delivering new features and refining the product is critical to remaining competitive. Software organizations may adopt continuous engineering practices to become more efficient. However, retrofitting an organization with a pipeline is challenging. Importantly, the most significant challenges and opportunities, are related to, but stem from outside the engineering realm and require rethinking customer relationships and business models. This paper presents a hierarchy of continuous engineering benefits and challenges. It is aimed to guide the adoption of continuous practices in an organization to determine the current and target level of adoption, given organizational context, ambitions, and domain constraints. IEEE</p>",
Klotins_165_2023,"Klotins, Eriks [ekx] [0000-0002-1987-2234] (Blekinge Tekniska Högskola [16500], Fakulteten för datavetenskaper [16801], Institutionen för programvaruteknik [16805]);Talbert-Goldstein, Elliot (University of Maryland, United States)",2023,Organizational Conflicts in the Adoption of Continuous Software Engineering,"<p>Software is a critical component of nearly every product or service. Improvements in software can lead to substantial competitive advantages. At the same time, software and surrounding engineering teams have become increasingly complex. The adoption of continuous integration and delivery is a recent trend to radically improve software release speed. However, its adoption is far from straightforward. Specifically, rethinking processes, organizational culture, ways of working, and business models require buy-in from diverse stakeholders that may have conflicting objectives. Such situations are explored by organizational conflict research. This paper reports on early lessons from an ongoing research project in continuous software engineering, specifically investigating adoption challenges from an organizational conflict perspective. We identify catalysts, symptoms, and outcomes of organizational conflicts hindering the adoption process. We conclude that predictable conflicts emerge when adopting continuous engineering. Engineers, managers, and other teams can proactively prepare for and allocate resources to resolve them. Proper analysis and management can help avoid wasted time, impeding processes, and frustration. © 2023, The Author(s).</p>",https://bth.diva-portal.org/smash/get/diva2:1774955/FULLTEXT01.pdf
Chen_50_2023,"Chen, Xingru [xcn] [0000-0003-1181-9049] (Blekinge Tekniska Högskola [16500], Fakulteten för datavetenskaper [16801], Institutionen för programvaruteknik [16805]);Usman, Muhammad [muu] [0000-0002-8132-0107] (Blekinge Tekniska Högskola [16500], Fakulteten för datavetenskaper [16801], Institutionen för programvaruteknik [16805]);Badampudi, Deepika [deb] [0000-0002-6215-1774] (Blekinge Tekniska Högskola [16500], Fakulteten för datavetenskaper [16801], Institutionen för programvaruteknik [16805])",2023,Using InnerSource for Improving Internal Reuse : An Industrial Case Study,"<p>Background: InnerSource consists of the use of open source development techniques within the corporation. It helps improve software reuse through increased transparency and inter-team collaboration. Companies need to understand their context and specific needs before deciding to adopt any specific InnerSource practices since they cannot apply all InnerSource practices at once. Aim: This study aims to support the case company in assessing its readiness for adopting InnerSource practices to improve its internal reuse, identify and prioritize the improvement areas, and identify suitable solutions. Method: We performed a case study using a questionnaire and a workshop to check the current and desired status of adopting InnerSource practices and collect potential solutions. Results: The study participants identified that the company needs to prioritize the improvements related to the discoverability, communication channels, and ownership of the reusable assets. In addition, they identified certain InnerSource practices as solutions for the prioritized improvement areas, such as better structured repositories for storing and searching the reusable assets and standardized documentation of the reusable assets. Conclusion: The questionnaire instrument aids the case company in identifying the improvement areas related to InnerSource and reuse practices. InnerSource practices could improve the development and maintenance of reusable assets. Keywords: InnerSource, software reuse, readiness © 2023 Owner/Author.</p>",https://bth.diva-portal.org/smash/get/diva2:1777791/FULLTEXT01.pdf
Sarika_269_2023,"Sarika, Pawan Kumar (Ericsson AB, Stockholm, Sweden);Badampudi, Deepika [deb] [0000-0002-6215-1774] (Blekinge Tekniska Högskola [16500], Fakulteten för datavetenskaper [16801], Institutionen för programvaruteknik [16805]);Josyula, Sai Prashanth [SPJ] [0000-0001-8377-8536] (Blekinge Tekniska Högskola [16500], Fakulteten för datavetenskaper [16801], Institutionen för datavetenskap [881506]);Usman, Muhammad [muu] [0000-0002-8132-0107] (Blekinge Tekniska Högskola [16500], Fakulteten för datavetenskaper [16801], Institutionen för programvaruteknik [16805])",2023,Automating Microservices Test Failure Analysis using Kubernetes Cluster Logs,"<p>Kubernetes is a free, open-source container orchestration system for deploying and managing Docker containers that host microservices. Kubernetes cluster logs help in determining the reason for the failure. However, as systems become more complex, identifying failure reasons manually becomes more difficult and time-consuming. This study aims to identify effective and efficient classification algorithms to automatically determine the failure reason. We compare five classification algorithms, Support Vector Machines, K-Nearest Neighbors, Random Forest, Gradient Boosting Classifier, and Multilayer Perceptron. Our results indicate that Random Forest produces good accuracy while requiring fewer computational resources than other algorithms. © 2023 Owner/Author.</p>",https://bth.diva-portal.org/smash/get/diva2:1777850/FULLTEXT01.pdf
Bendler_33_2023,"Bendler, Daniel (University Innsbruck, Austria.);Felderer, Michael [mfd] [0000-0003-3818-4442] (Blekinge Tekniska Högskola [16500], Fakulteten för datavetenskaper [16801], Institutionen för programvaruteknik [16805])",2023,Competency Models for Information Security and Cybersecurity Professionals : Analysis of Existing Work and a New Model,"<p>Competency models are widely adopted frameworks that are used to improve human resource functions and education. However, the characteristics of competency models related to the information security and cybersecurity domains are not well understood. To bridge this gap, this study investigates the current state of competency models related to the security domain through qualitative content analysis. Additionally, based on the competency model analysis, an evidence-based competency model is proposed. Examining the content of 27 models, we found that the models can benefit target groups in many different ways, ranging from policymaking to performance management. Owing to their many uses, competency models can arguably help to narrow the skills gap from which the profession is suffering. Nonetheless, the models have their shortcomings. First, the models do not cover all of the topics specified by the Cybersecurity Body of Knowledge ( i.e., no model is complete). Second, by omitting social, personal, and methodological competencies, many models reduce the competency profile of a security expert to professional competencies. Addressing the limitations of previous work, the proposed competency model provides a holistic view of the competencies required by security professionals for job achievement and can potentially benefit both the education system and the labor market. To conclude, the implications of the competency model analysis and use cases of the proposed model are discussed.</p>",https://bth.diva-portal.org/smash/get/diva2:1786480/FULLTEXT01.pdf
Unver_322_2023,"Unver, Burak (Ericsson AB, Sweden);Britto, Ricardo [rbr] [0000-0002-7220-9570] (Blekinge Tekniska Högskola [16500], Fakulteten för datavetenskaper [16801], Institutionen för programvaruteknik [16805]) (Ericsson AB, Sweden)",2023,Automatic Detection of Security Deficiencies and Refactoring Advises for Microservices,"<p>The microservice architecture enables organizations to shorten development cycles and deliver cloud-native applications rapidly. However, it also brings security concerns that need to be addressed by developers. Therefore, security testing in microservices becomes even more critical. Recent research papers indicate that security testing of microservices is often neglected for reasons such as lack of time, lack of experience in the security domain, and absence of automated test environments. Even though several security scanning tools exist to detect container, containerized workload management (Kubernetes), and network issues, none individually is sufficient to cover all security problems in microservices. Using multiple scanning tools increases the complexity of analyzing findings and mitigating security vulnerabilities. This paper presents a fully automated test tool suite that can help developers address security issues in microservices and resolve them. It targets to reduce time and effort in security activities by encapsulating open-source scanning tools into one suite and providing improved feedback. The developed security scanning suite is named Pomegranate. To develop Pomegranate, we employed Design Science and conducted our investigation in Ericsson. We have evaluated our tool using a static approach. The evaluation results indicate that the Pomegranate could be helpful to developers by providing simplified and classified outputs for security vulnerabilities in microservices. More than half of the practitioners who give us feedback found Pomegranate helpful in detecting and mitigating security problems in microservices. We conclude that a fully automated test tool suite can help developers to address most security issues in microservices. Based on the findings in this paper, the direction for future work is to conduct a dynamic validation of Pomegranate in a live project. © 2023 IEEE.</p>",https://bth.diva-portal.org/smash/get/diva2:1787087/FULLTEXT01.pdf
Chen_49_2024,"Chen, Xingru [xcn] [0000-0003-1181-9049] (Blekinge Tekniska Högskola [16500], Fakulteten för datavetenskaper [16801], Institutionen för programvaruteknik [16805]);Usman, Muhammad [muu] [0000-0002-8132-0107] (Blekinge Tekniska Högskola [16500], Fakulteten för datavetenskaper [16801], Institutionen för programvaruteknik [16805]);Badampudi, Deepika [deb] [0000-0002-6215-1774] (Blekinge Tekniska Högskola [16500], Fakulteten för datavetenskaper [16801], Institutionen för programvaruteknik [16805])",2024,Understanding and evaluating software reuse costs and benefits from industrial cases—A systematic literature review,"<p>Context: Software reuse costs and benefits have been investigated in several primary studies, which have been aggregated in multiple secondary studies as well. However, existing secondary studies on software reuse have not critically appraised the evidence in primary studies. Moreover, there has been relatively less focus on how software reuse costs and benefits were measured in the primary studies, and the aggregated evidence focuses more on software reuse benefits than reuse costs. Objective: This study aims to cover the gaps mentioned in the context above by synthesizing and critically appraising the evidence reported on software reuse costs and benefits from industrial cases. Method: We used a systematic literature review (SLR) to conduct this study. The results of this SLR are based on a final set of 30 primary studies. Results: We identified nine software reuse benefits and six software reuse costs, in which better quality and improved productivity were investigated the most. The primary studies mostly used defect-based and development time-based metrics to measure reuse benefits and costs. Regarding the reuse practices, the results show that software product lines, verbatim reuse, and systematic reuse were the top investigated ones, contributing to more reuse benefits. The quality assessment of the primary studies showed that most of them are either of low (20%) or moderate (67%) quality. Conclusion: Based on the number and quality of the studies, we conclude that the strength of evidence for better quality and improved productivity as reuse benefits is high. There is a need to conduct more high quality studies to investigate, not only other reuse costs and benefits, but also how relatively new reuse-related practices, such as InnerSource and microservices architecture, impact software reuse. © 2024 The Author(s)</p>",https://bth.diva-portal.org/smash/get/diva2:1849043/FULLTEXT01.pdf
Fucci_107_2024,"Fucci, Davide [dfu] [0000-0002-0679-4361] (Blekinge Tekniska Högskola [16500], Fakulteten för datavetenskaper [16801], Institutionen för programvaruteknik [16805]);Alégroth, Emil [EAL] [0000-0001-7526-3727] (Blekinge Tekniska Högskola [16500], Fakulteten för datavetenskaper [16801], Institutionen för programvaruteknik [16805]);Felderer, Michael [mfd] [0000-0003-3818-4442] (Blekinge Tekniska Högskola [16500], Fakulteten för datavetenskaper [16801], Institutionen för programvaruteknik [16805]);Johannesson, Christoffer (Ericsson, Karlskrona, Sweden)",2024,Evaluating software security maturity using OWASP SAMM : Different approaches and stakeholders perceptions,"<p>Background: Recent years have seen a surge in cyber-attacks, which can be prevented or mitigated using software security activities. OWASP SAMM is a maturity model providing a versatile way for companies to assess their security posture and plan for improvements. Objective: We perform an initial SAMM assessment in collaboration with a company in the financial domain. Our objective is to assess a holistic inventory of the company security-related activities, focusing on how different roles perform the assessment and how they perceive the instrument used in the process. Methodology: We perform a case study to collect data using SAMM in a lightweight and novel manner through assessment using an online survey with 17 participants and a focus group with seven participants. Results: We show that different roles perceive maturity differently and that the two assessments deviate only for specific practices making the lightweight approach a viable and efficient solution in industrial practice. Our results indicate that the questions included in the SAMM assessment tool are answered easily and confidently across most roles. Discussion: Our results suggest that companies can productively use a lightweight SAMM assessment. We provide nine lessons learned for guiding industrial practitioners in the evaluation of their current security posture as well as for academics wanting to utilize SAMM as a research tool in industrial settings. Editor's note: Open Science material was validated by the Journal of Systems and Software Open Science Board. © 2024 The Author(s)</p>",https://bth.diva-portal.org/smash/get/diva2:1857279/FULLTEXT01.pdf
Yu_358_2024,"Yu, Liang [lyu] [0000-0001-5949-1375] (Blekinge Tekniska Högskola [16500], Fakulteten för datavetenskaper [16801], Institutionen för programvaruteknik [16805]);Alégroth, Emil [EAL] [0000-0001-7526-3727] (Blekinge Tekniska Högskola [16500], Fakulteten för datavetenskaper [16801], Institutionen för programvaruteknik [16805]);Chatzipetrou, Panagiota (Örebro University);Gorschek, Tony [tgo] [0000-0002-3646-235x] (Blekinge Tekniska Högskola [16500], Fakulteten för datavetenskaper [16801], Institutionen för programvaruteknik [16805])",2024,Visualizing CI’s role in software quality attribute evaluation : A Roadmap for Using Continuous Integration Environments,"<p>Quality attributes of software systems, also known as system qualities, such as performance, security, and scalability, continue to grow in importance in industrial practice. The evaluation of quality attributes is critical to software development since optimizing a software system’s core attributes can provide marketing advantage and set a product apart from its competitors. Many existing studies of unsuccessful development projects report that lack of quality attribute evaluation is often a contributing factor of project failure. Therefore, continuous quality attribute evaluation, throughout the development process, is needed to ensure customers’ expectations and demands are met.</p><p>Manual evaluation of software attributes is common in many software development companies, but it has proven to be insufficient in meeting the demands of rapid releases and high-quality expectations from customers. Automated practices have therefore gained widespread popularity as a solution to enhance efficiency, reduce costs, and increase accuracy compared to manual evaluation.</p><p>One way to automate the evaluation is using continuous integration (CI) environments. The CI environment provides several benefits, such as fast feedback on code quality, early detection of quality defects, and visualization of system quality trends. As such, these environments inherently offer organizations the opportunity to continuously monitor the quality of their software systems. However, an immature automation process can result in negative outcomes, such as cost and schedule overruns, slow feedback loops, and delayed releases.</p><p>To improve the evaluation process, prior studies have investigated different key areas, including knowledge, processes, tools, and metrics. While leveraging these areas can have a positive impact on quality evaluation, to the best of our knowledge, there is a lack of frameworks that link CI environment knowledge, metrics, and evolution together.</p><p>In this article, we aim to fill this gap by presenting the state-of-practice of using CI environments for the evaluation of quality attributes. This is achieved through an industrial study at four partner companies. Study results show that metrics acquired from CI components have a positive effect on evaluating quality requirements. Through analyzing these results, we propose a model by providing guidelines to mature existing CI environments that organizations can use for quality improvements.</p><p>As such, we claim the following contributions of this study:</p><p>A generic model of how CI environments contribute to quality attribute evaluation.</p><p>Empirical evidence that demonstrates how CI components can be used to produce data supporting the evaluation of quality attributes with metrics.</p><p>A model, derived from the study results, which provides decision support to evolve software quality evaluation through CI environments over time. © 2024 Owner/Author.</p>",https://bth.diva-portal.org/smash/get/diva2:1871361/FULLTEXT01.pdf
