citationid,Name,Year,Title,Abstract,FullTextLink
Alégroth_14_2020,"Alégroth, Emil [EAL] (Blekinge Tekniska Högskola [16500], Fakulteten för datavetenskaper [16801], Institutionen för programvaruteknik [16805]) (SERL);Gorschek, Tony [tgo] (Blekinge Tekniska Högskola [16500], Fakulteten för datavetenskaper [16801], Institutionen för programvaruteknik [16805]) (SERL);Petersen, Kai [kps] [0000-0002-1532-8223] (Blekinge Tekniska Högskola [16500], Fakulteten för datavetenskaper [16801], Institutionen för programvaruteknik [16805]);Mattsson, Michael [mma] (Blekinge Tekniska Högskola [16500], Fakulteten för datavetenskaper [16801], Institutionen för programvaruteknik [16805]) (SERL)",2020,Characteristics that affect Preference of Decision Models for Asset Selection : An Industrial Questionnaire Survey,"<p>Modern software development relies on a combination of development and re-use of technical asset, e.g. software components, libraries and APIs.In the past, re-use was mostly conducted with internal assets but today external; open source, customer off-the-shelf (COTS) and assets developed through outsourcing are also common.This access to more asset alternatives presents new challenges regarding what assets to optimally chose and how to make this decision.To support decision-makers, decision-theory has been used to develop decision models for asset selection.However, very little industrial data has been presented in literature about the usefulness, or even perceived usefulness, of these models.Additionally, only limited information has been presented about what model characteristics that determine practitioner preference towards one model over another.</p><p><strong>Objective:</strong> The objective of this work is to evaluate what characteristics of decision models for asset selection that determine industrial practitioner preference of a model when given the choice of a decision-model of high precision or a model with high speed.</p><p><strong>Method: </strong>An industrial questionnaire survey is performed where a total of 33 practitioners, of varying roles, from 18 companies are tasked to compare two decision models for asset selection.Textual analysis and formal and descriptive statistics are then applied on the survey responses to answer the study's research questions.</p><p><strong>Results:</strong> The study shows that the practitioners had clear preference towards the decision model that emphasised speed over the one that emphasised decision precision.This conclusion was determined to be because one of the models was perceived faster, had lower complexity, had, was more flexible in use for different decisions, was more agile how it could be used in operation, its emphasis on people, its emphasis on ``good enough'' precision and ability to fail fast if a decision was a failure.Hence, seven characteristics that the practitioners considered important for their acceptance of the model.</p><p><strong>Conclusion:</strong> Industrial practitioner preference, which relates to acceptance, of decision models for asset selection is dependent on multiple characteristics that must be considered when developing a model for different types of decisions such as operational day-to-day decisions as well as more critical tactical or strategic decisions.The main contribution of this work are seven identified characteristics that can serve as industrial requirements for future research on decision models for asset selection.</p>",https://bth.diva-portal.org/smash/get/diva2:1354445/FULLTEXT01.pdf
Yu_357_2020,"Yu, Liang [lyu] [0000-0001-5949-1375] (Blekinge Tekniska Högskola [16500], Fakulteten för datavetenskaper [16801], Institutionen för programvaruteknik [16805]) (Qvantel Sweden AB);Alégroth, Emil [EAL] (Blekinge Tekniska Högskola [16500], Fakulteten för datavetenskaper [16801], Institutionen för programvaruteknik [16805]);Chatzipetrou, Panagiota [pac] [0000-0002-0311-1502] (Örebro universitet, SWE);Gorschek, Tony [tgo] (Blekinge Tekniska Högskola [16500], Fakulteten för datavetenskaper [16801], Institutionen för programvaruteknik [16805])",2020,Utilising CI environment for efficient and effective testing of NFRs,"<p>Context: Continuous integration (CI) is a practice that aims to continuously verify quality aspects of a software intensive system both for functional and non-functional requirements (NFRs). Functional requirements are the inputs of development and can be tested in isolation, utilising either manual or automated tests. In contrast, some NFRs are difficult to test without functionality, for NFRs are often aspects of functionality and express quality aspects. Lacking this testability attribute makes NFR testing complicated and, therefore, underrepresented in industrial practice. However, the emergence of CI has radically affected software development and created new avenues for software quality evaluation and quality information acquisition. Research has, consequently, been devoted to the utilisation of this additional information for more efficient and effective NFR verification. Objective: We aim to identify the state-of-the-art of utilising the CI environment for NFR testing, hereinafter referred to as CI-NFR testing. Method: Through rigorous selection, from an initial set of 747 papers, we identified 47 papers that describe how NFRs are tested in a CI environment. Evidence-based analysis, through coding, is performed on the identified papers in this SLR. Results: Firstly, ten CI approaches are described by the papers selected, each describing different tools and nine different NFRs where reported to be tested. Secondly, although possible, CI-NFR testing is associated with eight challenges that adversely affect its adoption. Thirdly, the identified CI-NFR testing processes are tool-driven, but there is a lack of NFR testing tools that can be used in the CI environment. Finally, we proposed a CI framework for NFRs testing. Conclusion: A synthesised CI framework is proposed for testing various NFRs, and associated CI tools are also mapped. This contribution is valuable as results of the study also show that CI-NFR testing can help improve the quality of NFR testing in practices. © 2019</p>",
Moyón_209_2020,"Moyón, Fabiola (Siemens AG, DEU);Bayr, Christoph (Technical University of Munich, DEU);Mendez, Daniel [dmz] (Blekinge Tekniska Högskola [16500], Fakulteten för datavetenskaper [16801], Institutionen för programvaruteknik [16805]);Dännart, Sebastian (Infodas GmbH, DEU);Beckers, Kristian (Siemens AG, DEU)",2020,A Light-Weight Tool for the Self-assessment of Security Compliance in Software Development : An Industry Case,"<p>Companies are often challenged to modify and improve their software development processes in order to make them compliant with security standards. The complexity of these processes renders it difficult for practitioners to validate and foresee the effort required for compliance assessments. Further, performing gap analyses when processes are not yet mature enough is costly and involving auditors in early stages is, in our experience, often inefficient. An easier and more productive approach is conducting a self-assessment. However, practitioners, in particular developers, quality engineers, and product owners face difficulties to identify security-relevant process artifacts as required by standards. They would benefit from a proper and light-weight tool to perform early compliance assessments of their processes w.r.t. security standards before entering an in-depth audit. In this paper, we report on our current effort at Siemens Corporate Technology to develop such a light-weight assessment tool to assess the security compliance of software development processes with the IEC 62443-4-1 standard, and we discuss first results from an interview-based evaluation. © 2020, Springer Nature Switzerland AG.</p>",
Lenz_183_2020,"Lenz, Luca (Sap);Felderer, Michael [mfd] [0000-0003-3818-4442] (Blekinge Tekniska Högskola [16500], Fakulteten för datavetenskaper [16801], Institutionen för programvaruteknik [16805]) (University of Innsbruck, AUT);Schwedes, Sascha (Sap);Müller, Kai (Sap)",2020,Explainable Priority Assessment of Software-Defects using Categorical Features at SAP HANA,"<p>We want to automate priority assessment of software defects. To do so we provide a tool which uses an explainability-driven framework and classical machine learning algorithms to keep the decisions transparent. Differing from other approaches we only use objective and categorical fields from the bug tracking system as features. This makes our approach lightweight and extremely fast. We perform binary classification with priority labels corresponding to deadlines. Additionally, we evaluate the tool on real data to ensure good performance in the practical use case. © 2020 ACM.</p>",https://bth.diva-portal.org/smash/get/diva2:1470733/FULLTEXT01.pdf
Villamizar_334_2020,"Villamizar, Hugo (Pontifical Catholic University of Rio de Janeiro, BRA);Kalinowski, Marcos (Pontifical Catholic University of Rio de Janeiro, BRA);Garcia, Alessandro F. (Pontifical Catholic University of Rio de Janeiro, BRA);Mendez, Daniel [dmz] (Blekinge Tekniska Högskola [16500], Fakulteten för datavetenskaper [16801], Institutionen för programvaruteknik [16805])",2020,An efficient approach for reviewing security-related aspects in agile requirements specifications of web applications,"<p>Defects in requirement specifications can have severe consequences during the software development life cycle. Some of them may result in poor product quality and/or time and budget overrun due to incorrect or missing quality characteristics, such as security. This characteristic requires special attention in web applications because they have become a target for manipulating sensible data. Several concerns make security difficult to deal with. For instance, security requirements are often misunderstood and improperly specified due to lack of security expertise and emphasis on security during early stages of software development. This often leads to unspecified or ill-defined security-related aspects. These concerns become even more challenging in agile contexts, where lightweight documentation is typically produced. To tackle this problem, we designed an approach for reviewing security-related aspects in agile requirements specifications of web applications. Our proposal considers user stories and security specifications as inputs and relates those user stories to security properties via natural language processing. Based on the related security properties, our approach identifies high-level security requirements from the Open Web Application Security Project (OWASP) to be verified and generates a reading technique to support reviewers in detecting defects. We evaluate our approach via three experimental trials conducted with 56 novice software engineers, measuring effectiveness, efficiency, usefulness and ease of use. We compare our approach against using: (1) the OWASP high-level security requirements and (2) a perspective-based approach as proposed in contemporary state of the art. The results strengthen our confidence that using our approach has a positive impact (with large effect size) on the performance of inspectors in terms of effectiveness and efficiency. © 2020, Springer-Verlag London Ltd., part of Springer Nature.</p>",https://bth.diva-portal.org/smash/get/diva2:1472656/FULLTEXT01.pdf
Shojaifar_273_2020,"Shojaifar, Alireza (FHNW, IIT and IMVS, CHE, Utrecht University, NLD);Fricker, Samuel [sfr] [0000-0001-7368-4448] (Blekinge Tekniska Högskola [16500], Fakulteten för datavetenskaper [16801], Institutionen för programvaruteknik [16805]) (SERL-Sweden, SWE, FHNW, IIT and IMVS, CHE);Gwerder, Martin (FHNW, IIT and IMVS, CHE)",2020,Automating the Communication of Cybersecurity Knowledge : Multi-case Study,"<p>Cybersecurity is essential for the protection of companies against cyber threats. Traditionally, cybersecurity experts assess and improve a company’s capabilities. However, many small and medium-sized businesses (SMBs) consider such services not to be affordable. We explore an alternative do-it-yourself (DIY) approach to bringing cybersecurity to SMBs. Our method and tool, CYSEC, implements the Self-Determination Theory (SDT) to guide and motivate SMBs to adopt good cybersecurity practices. CYSEC uses assessment questions and recommendations to communicate cybersecurity knowledge to the end-user SMBs and encourage self-motivated change. In this paper, the operationalisation of SDT in CYSEC is presented and the results of a multi-case study shown that offer insight into how SMBs adopted cybersecurity practices with CYSEC. Effective automated cybersecurity communication depended on the SMB’s hands-on skills, tools adaptedness, and the users’ willingness to documenting confidential information. The SMBs wanted to learn in simple, incremental steps, allowing them to understand what they do. An SMB’s motivation to improve security depended on the fitness of assessment questions and recommendations with the SMB’s business model and IT infrastructure. The results of this study indicate that automated counselling can help many SMBs in security adoption. © 2020, IFIP International Federation for Information Processing.</p>",https://bth.diva-portal.org/smash/get/diva2:1477548/FULLTEXT01.pdf
Sundelin_296_2020,"Sundelin, Anders [ars] [0000-0001-9898-2222] (Blekinge Tekniska Högskola [16500], Fakulteten för datavetenskaper [16801], Institutionen för programvaruteknik [16805]);Gonzalez-Huerta, Javier [jgh] [0000-0003-1350-7030] (Blekinge Tekniska Högskola [16500], Fakulteten för datavetenskaper [16801], Institutionen för programvaruteknik [16805]);Wnuk, Krzysztof [krw] [0000-0003-3567-9300] (Blekinge Tekniska Högskola [16500], Fakulteten för datavetenskaper [16801], Institutionen för programvaruteknik [16805])",2020,The hidden cost of backward compatibility : When deprecation turns into technical debt - An experience report,"<p>Context The micro-services architectural pattern advocates for the partitioning of functionality into loosely coupled services, which should be backward compatible, to enable independent upgrades. Deprecation is commonly used as a tool to manage multiple versions of methods or services. However, deprecation carries a cost in that tests might be duplicated and might rely on services that have become deprecated over time. Objective Using the terms of the Technical Debt metaphor, we explore the consequences of deprecation, and how it has affected the test base during seven years. Method We take an exploratory approach, reporting on experiences found before and after servicing parts of the incurred Technical Debt. We mine code repositories and validate our findings with experienced developers. Results We found that the growth of deprecation debt varied a lot. Some services experienced substantial growth, but most did not. Unit tests, where deprecation is visible in the developers' tools, were much less affected than integration tests, which lack such visualization mechanisms. While servicing debt of 121 out of 285 deprecated services, we discovered that up to 29% of the spent effort could be attributed to accrued interest. However, this is an upper bound; there could be less impact, depending on whether scripting could be used to service the debt or not. Conclusion This paper illustrates that integration tests can be viewed as a debt from the perspective of deprecated services. While the pattern was that deprecated services (debt principal) experienced no or little accrued interest, some, highly used, services experienced a lot, particularly during stressful times. Java-based tests, where deprecation is visible in the IDE, did not experience a similar pattern of increasing debt. We postulate that deprecation debt should be kept visible, either using developer tools or statistical reports. © 2020 ACM.</p>",https://bth.diva-portal.org/smash/get/diva2:1485431/FULLTEXT01.pdf
Ibiapina_139_2020,"Ibiapina, Irvayne Matheus De Sousa (Universidade Federal do Piauí, BRA);Neto, Pedro Santos (Universidade Federal do Piauí, BRA);Avelino, Guilherme (Universidade Federal do Piauí, BRA);Britto, Ricardo [rbr] [0000-0002-7220-9570] (Blekinge Tekniska Högskola [16500], Fakulteten för datavetenskaper [16801], Institutionen för programvaruteknik [16805]) (Ericsson AB)",2020,MiD : Enabling integration between web systems,"<p>Technological solutions are increasingly present in everyday corporate environments. These solutions assist in a variety of activities that are of paramount importance to your employees, customers and partners. However, as demands grow, the complexity of business needs increases, and as a result, technology systems need to evolve to maintain the standard of service quality. In this sense, the integration between systems is an alternative to help in this evolutionary scenario, enabling the sharing of resources between different systems, contemplating interoperability, reducing unwanted redundancies and eliminating bottlenecks and incompatibilities. However, despite the advantages and benefits, there are some inherent difficulties to achieve integration, which are: the effort spent on development, the integration process with Legacy Systems, the risks associated with software modifications and the integration with software developed by third parties. Because of this, we propose an approach and a tool, called MiD, to overcome such difficulties inherent in building Web Services. MiD simplifies the development of Web Services for integration between Web systems, enabling integration without the need for access to target system source code and low cost development and maintenance. An evaluation was performed to verify the advantages of using MiD in a real integration project. Preliminary results show that for the context used in the assessment environment, MiD has the potential to reduce effort in developing Web Services for integration. © 2020 ACM.</p>",
Moyon_207_2020,"Moyon, Fabiola (Technical University of Munich (TUM) and Siemens CT, DEU);Almeida, Pamela (Universidad San Francisco de Quito (USFQ), ECU);Riofrio, Daniel (Universidad San Francisco de Quito (USFQ), ECU);Mendez, Daniel [dmz] [0000-0003-0619-6027] (Blekinge Tekniska Högskola [16500], Fakulteten för datavetenskaper [16801], Institutionen för programvaruteknik [16805]);Kalinowski, Marcos (Pontifical Catholic University of Rio de Janeiro, BRA)",2020,Security Compliance in Agile Software Development : A Systematic Mapping Study,"<p>Companies adopting agile development tend to face challenges in complying with security norms. Existing research either focuses on how to integrate security into agile methods or on discussing compliance issues of agile methods but independently of the regulation type, in particular of security standards. A comprehensive overview of this scattered field is still missing and we know little about how to achieve security compliance in agile software development. Existing secondary studies (mapping studies and literature reviews) analyze publications on secure agile development, but they do not analyze implications of security standard compliance, e.g., integration of specific standard requirements or compliance assessments. To close this gap, we report on a systematic mapping study. Starting with a set of 2,383 papers, our work distills 11 relevant publications addressing security compliance in agile software development. With this study, we contribute by describing the maturity of the field, as well as domains where security compliant agile software engineering was investigated. Moreover, we make explicit which phases of a secure development process are covered by the field and which agile principles are analyzed when aiming at compliance with international security standards, country-specific security regulations, industry-specific security standards, and other well-known security frameworks. © 2020 IEEE.</p>",
Moyón_210_2020,"Moyón, Fabiola (Technical University of Munich and Siemens, DEU);Mendez, Daniel [dmz] [0000-0003-0619-6027] (Blekinge Tekniska Högskola [16500], Fakulteten för datavetenskaper [16801], Institutionen för programvaruteknik [16805]) (fortiss GmbH, DEU);Beckers, Kristian (Social Engineering Academy, DEU);Klepper, Sebastian (Technical University of Munich, DEU)",2020,How to Integrate Security Compliance Requirements with Agile Software Engineering at Scale?,"<p>Integrating security into agile software development is an open issue for research and practice. Especially in strongly regulated industries, complexity increases not only when scaling agile practices but also when aiming for compliance with security standards. To achieve security compliance in a large-scale agile context, we developed S2C-SAFe: An extension of the Scaled Agile Framework that is compliant to the security standard IEC 62443-4-1 for secure product development. In this paper, we present the framework and its evaluation by agile and security experts within Siemens’ large-scale project ecosystem. We discuss benefits and limitations as well as challenges from a practitioners’ perspective. Our results indicate that S2C-SAFe contributes to successfully integrating security compliance with lean and agile development in regulated environments. We also hope to raise awareness for the importance and challenges of integrating security in the scope of Continuous Software Engineering. © 2020, Springer Nature Switzerland AG.</p>",https://bth.diva-portal.org/smash/get/diva2:1514357/FULLTEXT01.pdf
Moyón_212_2020,"Moyón, Fabiola (Siemens CT and Technical University of Munich, DEU);Soares, Rafael Iankowski (Instituto Universitário de Lisboa (ISCTE-IUL), PRT);Pinto-Albuquerque, Maria (Instituto Universitário de Lisboa (ISCTE-IUL), PRT);Mendez, Daniel [dmz] [0000-0003-0619-6027] (Blekinge Tekniska Högskola [16500], Fakulteten för datavetenskaper [16801], Institutionen för programvaruteknik [16805]) (fortiss GmbH, DEU);Beckers, Kristian (Social Engineering Academy, DEU)",2020,Integration of Security Standards in DevOps Pipelines : An Industry Case Study,"<p>In the last decade, companies adopted DevOps as a fast path to deliver software products according to customer expectations, with well aligned teams and in continuous cycles. As a basic practice, DevOps relies on pipelines that simulate factory swim-lanes. The more automation in the pipeline, the shorter a lead time is supposed to be. However, applying DevOps is challenging, particularly for industrial control systems (ICS) that support critical infrastructures and that must obey to rigorous requirements from security regulations and standards. Current research on security compliant DevOps presents open gaps for this particular domain and in general for systematic application of security standards. In this paper, we present a systematic approach to integrate standard-based security activities into DevOps pipelines and highlight their automation potential. Our intention is to share our experiences and help practitioners to overcome the trade-off between adding security activities into the development process and keeping a short lead time. We conducted an evaluation of our approach at a large industrial company considering the IEC 62443-4-1 security standard that regulates ICS. The results strengthen our confidence in the usefulness of our approach and artefacts, and in that they can support practitioners to achieve security compliance while preserving agility including short lead times. © 2020, Springer Nature Switzerland AG.</p>",
Shojaifar_272_2020,"Shojaifar, Alireza (FHNW, CHE);Fricker, Samuel [sfr] [0000-0001-7368-4448] (Blekinge Tekniska Högskola [16500], Fakulteten för datavetenskaper [16801], Institutionen för programvaruteknik [16805]) (Utrecht University, NLD)",2020,SMEs’ Confidentiality Concerns for Security Information Sharing,"<p>Small and medium-sized enterprises (SME) are considered an essential part of the EU economy; however, highly vulnerable to cyber-attacks. SMEs have specific characteristics which separate them from large companies and influence their adoption of good cybersecurity practices. To mitigate the SMEs’ cybersecurity adoption issues and raise their awareness of cyber threats, we have designed a self-paced security assessment and capability improvement method, CYSEC. CYSEC is a security awareness and training method that utilises self-reporting questionnaires to collect companies’ information about cybersecurity awareness, practices, and vulnerabilities to generate automated recommendations for counselling. However, confidentiality concerns about cybersecurity information have an impact on companies’ willingness to share their information. Security information sharing decreases the risk of incidents and increases users’ self-efficacy in security awareness programs. This paper presents the results of semi-structured interviews with seven chief information security officers (CISOs) of SMEs to evaluate the impact of online consent communication on motivation for information sharing. The results were analysed in respect of the Self-Determination Theory (SDT). The findings demonstrate that online consent with multiple options for indicating a suitable level of agreement improved motivation for information sharing. This allows many SMEs to participate in security information sharing activities and supports security experts to have a better overview of common vulnerabilities. © 2020, IFIP International Federation for Information Processing.</p>",
